{"at": "2026-10-05T04:18:27+00:00", "code_commit": "a1317b09cd6af42e9ac05bac3a445ac3eb948a79.b52e773635af41d64a0b3523a80c2bfdfdd1f17a.3442ea8a6c7155325a9d87b9dab685b8d9969538", "config": {"columns": ["d1_21_r126", "d1_21_r252", "d1_42_r126", "d1_42_r252", "d1_63_r126", "d1_63_r252", "d1_84_r126", "d1_84_r252", "d1_126_r126", "d1_126_r252", "d1_189_r126", "d1_189_r252", "d2_21_r126", "d2_21_r252", "d2_42_r126", "d2_42_r252", "d2_63_r126", "d2_63_r252", "d2_84_r126", "d2_84_r252", "d2_126_r126", "d2_126_r252", "d2_189_r126", "d2_189_r252", "d3_21_r126", "d3_21_r252", "d3_42_r126", "d3_42_r252", "d3_63_r126", "d3_63_r252", "d3_84_r126", "d3_84_r252", "d3_126_r126", "d3_126_r252", "d3_189_r126", "d3_189_r252", "d5_21_r126", "d5_21_r252", "d5_42_r126", "d5_42_r252", "d5_63_r126", "d5_63_r252", "d5_84_r126", "d5_84_r252", "d5_126_r126", "d5_126_r252", "d5_189_r126", "d5_189_r252", "d7_21_r126", "d7_21_r252", "d7_42_r126", "d7_42_r252", "d7_63_r126", "d7_63_r252", "d7_84_r126", "d7_84_r252", "d7_126_r126", "d7_126_r252", "d7_189_r126", "d7_189_r252", "d10_21_r126", "d10_21_r252", "d10_42_r126", "d10_42_r252", "d10_63_r126", "d10_63_r252", "d10_84_r126", "d10_84_r252", "d10_126_r126", "d10_126_r252", "d10_189_r126", "d10_189_r252", "d30_21_r126", "d30_21_r252", "d30_42_r126", "d30_42_r252", "d30_63_r126", "d30_63_r252", "d30_84_r126", "d30_84_r252", "d30_126_r126", "d30_126_r252", "d30_189_r126", "d30_189_r252", "s12m5s_21_r126", "s12m5s_21_r252", "s12m5s_42_r126", "s12m5s_42_r252", "s12m5s_63_r126", "s12m5s_63_r252", "s12m5s_84_r126", "s12m5s_84_r252", "s12m5s_126_r126", "s12m5s_126_r252", "s12m5s_189_r126", "s12m5s_189_r252", "s3s10_21_r126", "s3s10_21_r252", "s3s10_42_r126", "s3s10_42_r252", "s3s10_63_r126", "s3s10_63_r252", "s3s10_84_r126", "s3s10_84_r252", "s3s10_126_r126", "s3s10_126_r252", "s3s10_189_r126", "s3s10_189_r252", "s10s30_21_r126", "s10s30_21_r252", "s10s30_42_r126", "s10s30_42_r252", "s10s30_63_r126", "s10s30_63_r252", "s10s30_84_r126", "s10s30_84_r252", "s10s30_126_r126", "s10s30_126_r252", "s10s30_189_r126", "s10s30_189_r252", "c5_21_r126", "c5_21_r252", "c5_42_r126", "c5_42_r252", "c5_63_r126", "c5_63_r252", "c5_84_r126", "c5_84_r252", "c5_126_r126", "c5_126_r252", "c5_189_r126", "c5_189_r252", "vol1_r252", "vol2_r252", "vol3_r252", "vol5_r252", "vol7_r252", "vol10_r252", "vol30_r252"], "config": {"apply_collinearity_rule": false, "bootstrap": {"block_weeks": 26, "n_resamples": 2000, "seed": 0}, "burn_in_days": 504, "effective_n_cut": 0.2, "feature_set": "tyccles", "first_train_end": "1987-12-31", "frozen_train_end": "1997-12-31", "ftic": {"k0": 3, "max_jump_fraction": 0.4, "mean_phase_days": 40, "saturated_k": 6}, "holdout_start": "2024-10-01", "horizon_long_days": 65, "horizon_short_days": 20, "jump_penalties": [0.5, 1.2, 3.0, 8.0, 20.0, 50.0], "jump_penalty_per_feature": true, "k_values": [2, 3, 4, 5], "pbo_blocks": 16, "prior_trial_logs": ["trials/trials.jsonl"], "refit_weeks": 26, "series": ["DGS1", "DGS2", "DGS3", "DGS5", "DGS7", "DGS10", "DGS30"], "start": "1977-02-15", "thresholds": {"collinearity_max": 0.8, "independence_p_max": 0.01, "min_median_duration_days": 20, "pbo_max": 0.05, "stability_min": 0.6}, "tyccles": {"change_horizons_days": [21, 42, 63, 84, 126, 189], "rank_windows_days": [126, 252], "vol_rank_window_days": 252, "vol_window_days": 21}}, "environment": {"jumpmodels": "0.1.1", "numpy": "2.5.3", "pandas": "3.0.6", "python": "3.14.2", "scikit-learn": "1.9.1", "scipy": "1.18.1"}, "hypotheses": ["H1 (diagnostic, not a criterion): with rank features the refit K-means baselines pass the minimum median duration.", "H2: at least one jump model configuration passes every blocking criterion.", "H3: the frozen K-means passes every blocking criterion."], "prior_trial_logs": [{"n_trials": 29, "path": "trials/trials.jsonl", "verdict": "no-go"}]}, "hypothesis": "Feature set fixed on the first training window; every parameter fixed in advance.", "kind": "registered", "snapshot_hash": "402c4c41fb184462bc47d8d7e1d04743b713e9a0bab0a6c71925f4227623b1dd", "trial_id": "setup"}
{"at": "2026-10-05T04:18:27+00:00", "code_commit": "a1317b09cd6af42e9ac05bac3a445ac3eb948a79.b52e773635af41d64a0b3523a80c2bfdfdd1f17a.3442ea8a6c7155325a9d87b9dab685b8d9969538", "config": {"jump_penalty": 0.5, "model": "jump", "n_states": 2}, "hypothesis": "A jump model with 2 states and penalty 0.5 gives stable regimes that separate the forward 10Y move.", "kind": "registered", "snapshot_hash": "402c4c41fb184462bc47d8d7e1d04743b713e9a0bab0a6c71925f4227623b1dd", "trial_id": "jm_k2_lam0.5"}
{"at": "2026-10-05T04:18:27+00:00", "code_commit": "a1317b09cd6af42e9ac05bac3a445ac3eb948a79.b52e773635af41d64a0b3523a80c2bfdfdd1f17a.3442ea8a6c7155325a9d87b9dab685b8d9969538", "config": {"jump_penalty": 1.2, "model": "jump", "n_states": 2}, "hypothesis": "A jump model with 2 states and penalty 1.2 gives stable regimes that separate the forward 10Y move.", "kind": "registered", "snapshot_hash": "402c4c41fb184462bc47d8d7e1d04743b713e9a0bab0a6c71925f4227623b1dd", "trial_id": "jm_k2_lam1.2"}
{"at": "2026-10-05T04:18:27+00:00", "code_commit": "a1317b09cd6af42e9ac05bac3a445ac3eb948a79.b52e773635af41d64a0b3523a80c2bfdfdd1f17a.3442ea8a6c7155325a9d87b9dab685b8d9969538", "config": {"jump_penalty": 3.0, "model": "jump", "n_states": 2}, "hypothesis": "A jump model with 2 states and penalty 3 gives stable regimes that separate the forward 10Y move.", "kind": "registered", "snapshot_hash": "402c4c41fb184462bc47d8d7e1d04743b713e9a0bab0a6c71925f4227623b1dd", "trial_id": "jm_k2_lam3"}
{"at": "2026-10-05T04:18:27+00:00", "code_commit": "a1317b09cd6af42e9ac05bac3a445ac3eb948a79.b52e773635af41d64a0b3523a80c2bfdfdd1f17a.3442ea8a6c7155325a9d87b9dab685b8d9969538", "config": {"jump_penalty": 8.0, "model": "jump", "n_states": 2}, "hypothesis": "A jump model with 2 states and penalty 8 gives stable regimes that separate the forward 10Y move.", "kind": "registered", "snapshot_hash": "402c4c41fb184462bc47d8d7e1d04743b713e9a0bab0a6c71925f4227623b1dd", "trial_id": "jm_k2_lam8"}
{"at": "2026-10-05T04:18:27+00:00", "code_commit": "a1317b09cd6af42e9ac05bac3a445ac3eb948a79.b52e773635af41d64a0b3523a80c2bfdfdd1f17a.3442ea8a6c7155325a9d87b9dab685b8d9969538", "config": {"jump_penalty": 20.0, "model": "jump", "n_states": 2}, "hypothesis": "A jump model with 2 states and penalty 20 gives stable regimes that separate the forward 10Y move.", "kind": "registered", "snapshot_hash": "402c4c41fb184462bc47d8d7e1d04743b713e9a0bab0a6c71925f4227623b1dd", "trial_id": "jm_k2_lam20"}
{"at": "2026-10-05T04:18:27+00:00", "code_commit": "a1317b09cd6af42e9ac05bac3a445ac3eb948a79.b52e773635af41d64a0b3523a80c2bfdfdd1f17a.3442ea8a6c7155325a9d87b9dab685b8d9969538", "config": {"jump_penalty": 50.0, "model": "jump", "n_states": 2}, "hypothesis": "A jump model with 2 states and penalty 50 gives stable regimes that separate the forward 10Y move.", "kind": "registered", "snapshot_hash": "402c4c41fb184462bc47d8d7e1d04743b713e9a0bab0a6c71925f4227623b1dd", "trial_id": "jm_k2_lam50"}
{"at": "2026-10-05T04:18:27+00:00", "code_commit": "a1317b09cd6af42e9ac05bac3a445ac3eb948a79.b52e773635af41d64a0b3523a80c2bfdfdd1f17a.3442ea8a6c7155325a9d87b9dab685b8d9969538", "config": {"model": "kmeans", "n_states": 2}, "hypothesis": "Baseline: the same model without a jump penalty.", "kind": "registered", "snapshot_hash": "402c4c41fb184462bc47d8d7e1d04743b713e9a0bab0a6c71925f4227623b1dd", "trial_id": "kmeans_k2"}
{"at": "2026-10-05T04:18:27+00:00", "code_commit": "a1317b09cd6af42e9ac05bac3a445ac3eb948a79.b52e773635af41d64a0b3523a80c2bfdfdd1f17a.3442ea8a6c7155325a9d87b9dab685b8d9969538", "config": {"model": "kmeans_frozen", "n_states": 2}, "hypothesis": "K-means fitted once through 1997-12-31 with 2 states gives stable regimes that separate the forward 10Y move.", "kind": "registered", "snapshot_hash": "402c4c41fb184462bc47d8d7e1d04743b713e9a0bab0a6c71925f4227623b1dd", "trial_id": "kmf_k2"}
{"at": "2026-10-05T04:18:27+00:00", "code_commit": "a1317b09cd6af42e9ac05bac3a445ac3eb948a79.b52e773635af41d64a0b3523a80c2bfdfdd1f17a.3442ea8a6c7155325a9d87b9dab685b8d9969538", "config": {"jump_penalty": 0.5, "model": "jump", "n_states": 3}, "hypothesis": "A jump model with 3 states and penalty 0.5 gives stable regimes that separate the forward 10Y move.", "kind": "registered", "snapshot_hash": "402c4c41fb184462bc47d8d7e1d04743b713e9a0bab0a6c71925f4227623b1dd", "trial_id": "jm_k3_lam0.5"}
{"at": "2026-10-05T04:18:27+00:00", "code_commit": "a1317b09cd6af42e9ac05bac3a445ac3eb948a79.b52e773635af41d64a0b3523a80c2bfdfdd1f17a.3442ea8a6c7155325a9d87b9dab685b8d9969538", "config": {"jump_penalty": 1.2, "model": "jump", "n_states": 3}, "hypothesis": "A jump model with 3 states and penalty 1.2 gives stable regimes that separate the forward 10Y move.", "kind": "registered", "snapshot_hash": "402c4c41fb184462bc47d8d7e1d04743b713e9a0bab0a6c71925f4227623b1dd", "trial_id": "jm_k3_lam1.2"}
{"at": "2026-10-05T04:18:27+00:00", "code_commit": "a1317b09cd6af42e9ac05bac3a445ac3eb948a79.b52e773635af41d64a0b3523a80c2bfdfdd1f17a.3442ea8a6c7155325a9d87b9dab685b8d9969538", "config": {"jump_penalty": 3.0, "model": "jump", "n_states": 3}, "hypothesis": "A jump model with 3 states and penalty 3 gives stable regimes that separate the forward 10Y move.", "kind": "registered", "snapshot_hash": "402c4c41fb184462bc47d8d7e1d04743b713e9a0bab0a6c71925f4227623b1dd", "trial_id": "jm_k3_lam3"}
{"at": "2026-10-05T04:18:27+00:00", "code_commit": "a1317b09cd6af42e9ac05bac3a445ac3eb948a79.b52e773635af41d64a0b3523a80c2bfdfdd1f17a.3442ea8a6c7155325a9d87b9dab685b8d9969538", "config": {"jump_penalty": 8.0, "model": "jump", "n_states": 3}, "hypothesis": "A jump model with 3 states and penalty 8 gives stable regimes that separate the forward 10Y move.", "kind": "registered", "snapshot_hash": "402c4c41fb184462bc47d8d7e1d04743b713e9a0bab0a6c71925f4227623b1dd", "trial_id": "jm_k3_lam8"}
{"at": "2026-10-05T04:18:27+00:00", "code_commit": "a1317b09cd6af42e9ac05bac3a445ac3eb948a79.b52e773635af41d64a0b3523a80c2bfdfdd1f17a.3442ea8a6c7155325a9d87b9dab685b8d9969538", "config": {"jump_penalty": 20.0, "model": "jump", "n_states": 3}, "hypothesis": "A jump model with 3 states and penalty 20 gives stable regimes that separate the forward 10Y move.", "kind": "registered", "snapshot_hash": "402c4c41fb184462bc47d8d7e1d04743b713e9a0bab0a6c71925f4227623b1dd", "trial_id": "jm_k3_lam20"}
{"at": "2026-10-05T04:18:27+00:00", "code_commit": "a1317b09cd6af42e9ac05bac3a445ac3eb948a79.b52e773635af41d64a0b3523a80c2bfdfdd1f17a.3442ea8a6c7155325a9d87b9dab685b8d9969538", "config": {"jump_penalty": 50.0, "model": "jump", "n_states": 3}, "hypothesis": "A jump model with 3 states and penalty 50 gives stable regimes that separate the forward 10Y move.", "kind": "registered", "snapshot_hash": "402c4c41fb184462bc47d8d7e1d04743b713e9a0bab0a6c71925f4227623b1dd", "trial_id": "jm_k3_lam50"}
{"at": "2026-10-05T04:18:27+00:00", "code_commit": "a1317b09cd6af42e9ac05bac3a445ac3eb948a79.b52e773635af41d64a0b3523a80c2bfdfdd1f17a.3442ea8a6c7155325a9d87b9dab685b8d9969538", "config": {"model": "kmeans", "n_states": 3}, "hypothesis": "Baseline: the same model without a jump penalty.", "kind": "registered", "snapshot_hash": "402c4c41fb184462bc47d8d7e1d04743b713e9a0bab0a6c71925f4227623b1dd", "trial_id": "kmeans_k3"}
{"at": "2026-10-05T04:18:27+00:00", "code_commit": "a1317b09cd6af42e9ac05bac3a445ac3eb948a79.b52e773635af41d64a0b3523a80c2bfdfdd1f17a.3442ea8a6c7155325a9d87b9dab685b8d9969538", "config": {"model": "kmeans_frozen", "n_states": 3}, "hypothesis": "K-means fitted once through 1997-12-31 with 3 states gives stable regimes that separate the forward 10Y move.", "kind": "registered", "snapshot_hash": "402c4c41fb184462bc47d8d7e1d04743b713e9a0bab0a6c71925f4227623b1dd", "trial_id": "kmf_k3"}
{"at": "2026-10-05T04:18:27+00:00", "code_commit": "a1317b09cd6af42e9ac05bac3a445ac3eb948a79.b52e773635af41d64a0b3523a80c2bfdfdd1f17a.3442ea8a6c7155325a9d87b9dab685b8d9969538", "config": {"jump_penalty": 0.5, "model": "jump", "n_states": 4}, "hypothesis": "A jump model with 4 states and penalty 0.5 gives stable regimes that separate the forward 10Y move.", "kind": "registered", "snapshot_hash": "402c4c41fb184462bc47d8d7e1d04743b713e9a0bab0a6c71925f4227623b1dd", "trial_id": "jm_k4_lam0.5"}
{"at": "2026-10-05T04:18:27+00:00", "code_commit": "a1317b09cd6af42e9ac05bac3a445ac3eb948a79.b52e773635af41d64a0b3523a80c2bfdfdd1f17a.3442ea8a6c7155325a9d87b9dab685b8d9969538", "config": {"jump_penalty": 1.2, "model": "jump", "n_states": 4}, "hypothesis": "A jump model with 4 states and penalty 1.2 gives stable regimes that separate the forward 10Y move.", "kind": "registered", "snapshot_hash": "402c4c41fb184462bc47d8d7e1d04743b713e9a0bab0a6c71925f4227623b1dd", "trial_id": "jm_k4_lam1.2"}
{"at": "2026-10-05T04:18:27+00:00", "code_commit": "a1317b09cd6af42e9ac05bac3a445ac3eb948a79.b52e773635af41d64a0b3523a80c2bfdfdd1f17a.3442ea8a6c7155325a9d87b9dab685b8d9969538", "config": {"jump_penalty": 3.0, "model": "jump", "n_states": 4}, "hypothesis": "A jump model with 4 states and penalty 3 gives stable regimes that separate the forward 10Y move.", "kind": "registered", "snapshot_hash": "402c4c41fb184462bc47d8d7e1d04743b713e9a0bab0a6c71925f4227623b1dd", "trial_id": "jm_k4_lam3"}
{"at": "2026-10-05T04:18:27+00:00", "code_commit": "a1317b09cd6af42e9ac05bac3a445ac3eb948a79.b52e773635af41d64a0b3523a80c2bfdfdd1f17a.3442ea8a6c7155325a9d87b9dab685b8d9969538", "config": {"jump_penalty": 8.0, "model": "jump", "n_states": 4}, "hypothesis": "A jump model with 4 states and penalty 8 gives stable regimes that separate the forward 10Y move.", "kind": "registered", "snapshot_hash": "402c4c41fb184462bc47d8d7e1d04743b713e9a0bab0a6c71925f4227623b1dd", "trial_id": "jm_k4_lam8"}
{"at": "2026-10-05T04:18:27+00:00", "code_commit": "a1317b09cd6af42e9ac05bac3a445ac3eb948a79.b52e773635af41d64a0b3523a80c2bfdfdd1f17a.3442ea8a6c7155325a9d87b9dab685b8d9969538", "config": {"jump_penalty": 20.0, "model": "jump", "n_states": 4}, "hypothesis": "A jump model with 4 states and penalty 20 gives stable regimes that separate the forward 10Y move.", "kind": "registered", "snapshot_hash": "402c4c41fb184462bc47d8d7e1d04743b713e9a0bab0a6c71925f4227623b1dd", "trial_id": "jm_k4_lam20"}
{"at": "2026-10-05T04:18:27+00:00", "code_commit": "a1317b09cd6af42e9ac05bac3a445ac3eb948a79.b52e773635af41d64a0b3523a80c2bfdfdd1f17a.3442ea8a6c7155325a9d87b9dab685b8d9969538", "config": {"jump_penalty": 50.0, "model": "jump", "n_states": 4}, "hypothesis": "A jump model with 4 states and penalty 50 gives stable regimes that separate the forward 10Y move.", "kind": "registered", "snapshot_hash": "402c4c41fb184462bc47d8d7e1d04743b713e9a0bab0a6c71925f4227623b1dd", "trial_id": "jm_k4_lam50"}
{"at": "2026-10-05T04:18:27+00:00", "code_commit": "a1317b09cd6af42e9ac05bac3a445ac3eb948a79.b52e773635af41d64a0b3523a80c2bfdfdd1f17a.3442ea8a6c7155325a9d87b9dab685b8d9969538", "config": {"model": "kmeans", "n_states": 4}, "hypothesis": "Baseline: the same model without a jump penalty.", "kind": "registered", "snapshot_hash": "402c4c41fb184462bc47d8d7e1d04743b713e9a0bab0a6c71925f4227623b1dd", "trial_id": "kmeans_k4"}
{"at": "2026-10-05T04:18:27+00:00", "code_commit": "a1317b09cd6af42e9ac05bac3a445ac3eb948a79.b52e773635af41d64a0b3523a80c2bfdfdd1f17a.3442ea8a6c7155325a9d87b9dab685b8d9969538", "config": {"model": "kmeans_frozen", "n_states": 4}, "hypothesis": "K-means fitted once through 1997-12-31 with 4 states gives stable regimes that separate the forward 10Y move.", "kind": "registered", "snapshot_hash": "402c4c41fb184462bc47d8d7e1d04743b713e9a0bab0a6c71925f4227623b1dd", "trial_id": "kmf_k4"}
{"at": "2026-10-05T04:18:27+00:00", "code_commit": "a1317b09cd6af42e9ac05bac3a445ac3eb948a79.b52e773635af41d64a0b3523a80c2bfdfdd1f17a.3442ea8a6c7155325a9d87b9dab685b8d9969538", "config": {"jump_penalty": 0.5, "model": "jump", "n_states": 5}, "hypothesis": "A jump model with 5 states and penalty 0.5 gives stable regimes that separate the forward 10Y move.", "kind": "registered", "snapshot_hash": "402c4c41fb184462bc47d8d7e1d04743b713e9a0bab0a6c71925f4227623b1dd", "trial_id": "jm_k5_lam0.5"}
{"at": "2026-10-05T04:18:27+00:00", "code_commit": "a1317b09cd6af42e9ac05bac3a445ac3eb948a79.b52e773635af41d64a0b3523a80c2bfdfdd1f17a.3442ea8a6c7155325a9d87b9dab685b8d9969538", "config": {"jump_penalty": 1.2, "model": "jump", "n_states": 5}, "hypothesis": "A jump model with 5 states and penalty 1.2 gives stable regimes that separate the forward 10Y move.", "kind": "registered", "snapshot_hash": "402c4c41fb184462bc47d8d7e1d04743b713e9a0bab0a6c71925f4227623b1dd", "trial_id": "jm_k5_lam1.2"}
{"at": "2026-10-05T04:18:27+00:00", "code_commit": "a1317b09cd6af42e9ac05bac3a445ac3eb948a79.b52e773635af41d64a0b3523a80c2bfdfdd1f17a.3442ea8a6c7155325a9d87b9dab685b8d9969538", "config": {"jump_penalty": 3.0, "model": "jump", "n_states": 5}, "hypothesis": "A jump model with 5 states and penalty 3 gives stable regimes that separate the forward 10Y move.", "kind": "registered", "snapshot_hash": "402c4c41fb184462bc47d8d7e1d04743b713e9a0bab0a6c71925f4227623b1dd", "trial_id": "jm_k5_lam3"}
{"at": "2026-10-05T04:18:27+00:00", "code_commit": "a1317b09cd6af42e9ac05bac3a445ac3eb948a79.b52e773635af41d64a0b3523a80c2bfdfdd1f17a.3442ea8a6c7155325a9d87b9dab685b8d9969538", "config": {"jump_penalty": 8.0, "model": "jump", "n_states": 5}, "hypothesis": "A jump model with 5 states and penalty 8 gives stable regimes that separate the forward 10Y move.", "kind": "registered", "snapshot_hash": "402c4c41fb184462bc47d8d7e1d04743b713e9a0bab0a6c71925f4227623b1dd", "trial_id": "jm_k5_lam8"}
{"at": "2026-10-05T04:18:27+00:00", "code_commit": "a1317b09cd6af42e9ac05bac3a445ac3eb948a79.b52e773635af41d64a0b3523a80c2bfdfdd1f17a.3442ea8a6c7155325a9d87b9dab685b8d9969538", "config": {"jump_penalty": 20.0, "model": "jump", "n_states": 5}, "hypothesis": "A jump model with 5 states and penalty 20 gives stable regimes that separate the forward 10Y move.", "kind": "registered", "snapshot_hash": "402c4c41fb184462bc47d8d7e1d04743b713e9a0bab0a6c71925f4227623b1dd", "trial_id": "jm_k5_lam20"}
{"at": "2026-10-05T04:18:27+00:00", "code_commit": "a1317b09cd6af42e9ac05bac3a445ac3eb948a79.b52e773635af41d64a0b3523a80c2bfdfdd1f17a.3442ea8a6c7155325a9d87b9dab685b8d9969538", "config": {"jump_penalty": 50.0, "model": "jump", "n_states": 5}, "hypothesis": "A jump model with 5 states and penalty 50 gives stable regimes that separate the forward 10Y move.", "kind": "registered", "snapshot_hash": "402c4c41fb184462bc47d8d7e1d04743b713e9a0bab0a6c71925f4227623b1dd", "trial_id": "jm_k5_lam50"}
{"at": "2026-10-05T04:18:27+00:00", "code_commit": "a1317b09cd6af42e9ac05bac3a445ac3eb948a79.b52e773635af41d64a0b3523a80c2bfdfdd1f17a.3442ea8a6c7155325a9d87b9dab685b8d9969538", "config": {"model": "kmeans", "n_states": 5}, "hypothesis": "Baseline: the same model without a jump penalty.", "kind": "registered", "snapshot_hash": "402c4c41fb184462bc47d8d7e1d04743b713e9a0bab0a6c71925f4227623b1dd", "trial_id": "kmeans_k5"}
{"at": "2026-10-05T04:18:27+00:00", "code_commit": "a1317b09cd6af42e9ac05bac3a445ac3eb948a79.b52e773635af41d64a0b3523a80c2bfdfdd1f17a.3442ea8a6c7155325a9d87b9dab685b8d9969538", "config": {"model": "kmeans_frozen", "n_states": 5}, "hypothesis": "K-means fitted once through 1997-12-31 with 5 states gives stable regimes that separate the forward 10Y move.", "kind": "registered", "snapshot_hash": "402c4c41fb184462bc47d8d7e1d04743b713e9a0bab0a6c71925f4227623b1dd", "trial_id": "kmf_k5"}
{"at": "2026-10-05T04:18:27+00:00", "code_commit": "a1317b09cd6af42e9ac05bac3a445ac3eb948a79.b52e773635af41d64a0b3523a80c2bfdfdd1f17a.3442ea8a6c7155325a9d87b9dab685b8d9969538", "config": {"model": "inertia"}, "hypothesis": "Baseline: sign of the smoothed 63-day change of the level.", "kind": "registered", "snapshot_hash": "402c4c41fb184462bc47d8d7e1d04743b713e9a0bab0a6c71925f4227623b1dd", "trial_id": "inertia"}
{"at": "2026-10-05T04:23:08+00:00", "kind": "result", "labels_path": "trials/exp2/labels/jm_k2_lam0.5.csv", "labels_sha256": "62cdae5a0556297c2156c13c201948846a2a8bcc7b24983ab666827a81d6539c", "metrics": {"durations": {"0": 40.0, "1": 35.0}, "eta_short": 0.001118703650421148, "excess_long": -0.002116549525102468, "excess_short": -0.0005677423405124624, "excess_short_shift": -0.0021978841210521976, "frozen": false, "jump_penalty_effective": 69.5, "jumps": 156, "passes_duration": true, "s1_mean": 0.9892039146023616, "s1_min": 0.9239513727377976, "s2": 0.8312671425623548, "score": -0.0005167792494149465, "stability": 0.9102355285823582, "wcss": 1110412.1026043333}, "reason": "", "status": "kept", "trial_id": "jm_k2_lam0.5"}
{"at": "2026-10-05T04:26:38+00:00", "kind": "result", "labels_path": "trials/exp2/labels/jm_k2_lam1.2.csv", "labels_sha256": "9324a8a9f33cdea86ddb54e1fb00613b75cb6a406702081287305bfb872dcc8d", "metrics": {"durations": {"0": 56.5, "1": 72.0}, "eta_short": 0.00034365320644801686, "excess_long": -0.0019045639220558524, "excess_short": -0.0014600228793410434, "excess_short_shift": -0.0029835906827016144, "frozen": false, "jump_penalty_effective": 166.79999999999998, "jumps": 126, "passes_duration": true, "s1_mean": 0.9916088400109001, "s1_min": 0.9604432718282725, "s2": 0.8531672581991513, "score": -0.0013467076553240873, "stability": 0.9223880491050257, "wcss": 1116159.1813750244}, "reason": "", "status": "kept", "trial_id": "jm_k2_lam1.2"}
