{"at": "2026-10-05T04:29:52+00:00", "kind": "result", "labels_path": "trials/exp2/labels/jm_k2_lam3.csv", "labels_sha256": "d4ad128a87018b274f85028ac629569b25d116fd4b8c70a16c9732c4010d0e4f", "metrics": {"durations": {"0": 65.5, "1": 94.0}, "eta_short": 8.61465641283192e-08, "excess_long": -0.00031749283020533065, "excess_short": -0.0019640366714399455, "excess_short_shift": -0.0033685740653669138, "frozen": false, "jump_penalty_effective": 417.0, "jumps": 104, "passes_duration": true, "s1_mean": 0.9764100639659395, "s1_min": 0.8217292256243457, "s2": 0.839607111472872, "score": -0.0017833621642633073, "stability": 0.9080085877194057, "wcss": 1126913.6150888123}, "reason": "", "status": "kept", "trial_id": "jm_k2_lam3"}
{"at": "2026-10-05T04:32:57+00:00", "kind": "result", "labels_path": "trials/exp2/labels/jm_k2_lam8.csv", "labels_sha256": "8ac7920b09fcc91e7ccf7bace98a59fae73642b0720705ec01eb2f80e6d8cfa6", "metrics": {"durations": {"0": 100.0, "1": 108.0}, "eta_short": 8.520397460614438e-05, "excess_long": -0.004512651891633923, "excess_short": -0.0019857445742211236, "excess_short_shift": -0.003124283048604636, "frozen": false, "jump_penalty_effective": 1112.0, "jumps": 66, "passes_duration": true, "s1_mean": 0.9831006964508976, "s1_min": 0.9147793981845627, "s2": 0.8552905522633382, "score": -0.0018252877237149448, "stability": 0.9191956243571179, "wcss": 1183354.580424726}, "reason": "", "status": "kept", "trial_id": "jm_k2_lam8"}
{"at": "2026-10-05T04:35:29+00:00", "kind": "result", "labels_path": "trials/exp2/labels/jm_k2_lam20.csv", "labels_sha256": "6a82eeb36e1c136f8ca42a818720f4b6409fc13a437a738927c115c94efd4539", "metrics": {"durations": {"0": 97.5, "1": 117.0}, "eta_short": 0.0006872208789377828, "excess_long": 0.0010877525017171635, "excess_short": -0.0011847352171524025, "excess_short_shift": -0.0022074870584942357, "frozen": false, "jump_penalty_effective": 2780.0, "jumps": 34, "passes_duration": true, "s1_mean": 0.9604117607860536, "s1_min": 0.03010774024991365, "s2": 0.715557758505723, "score": -0.0009927900561894753, "stability": 0.8379847596458883, "wcss": 1313766.818146628}, "reason": "", "status": "kept", "trial_id": "jm_k2_lam20"}
{"at": "2026-10-05T04:36:49+00:00", "kind": "result", "labels_path": "trials/exp2/labels/jm_k2_lam50.csv", "labels_sha256": "1e040c5289674cd8e1dc1d253d4cd596c493c3afca623472b9f267c339c04e3a", "metrics": {"durations": {"0": 379.0, "1": 49.0}, "eta_short": 0.0015016415614528586, "excess_long": 0.0010598711800567373, "excess_short": -0.0008253852968449678, "excess_short_shift": -0.0004955509898360098, "frozen": false, "jump_penalty_effective": 6950.0, "jumps": 2, "passes_duration": true, "s1_mean": 0.7614518431255908, "s1_min": -0.06258750583620697, "s2": 0.0, "score": -0.00031424557778568176, "stability": 0.3807259215627954, "wcss": 1556553.8146860434}, "reason": "", "status": "kept", "trial_id": "jm_k2_lam50"}
{"at": "2026-10-05T04:36:57+00:00", "kind": "result", "labels_path": "trials/exp2/labels/kmeans_k2.csv", "labels_sha256": "f79216f191c691549cf52288a4a933262011df66c4d43d4d64d9c59d34180952", "metrics": {"durations": {"0": 4.0, "1": 3.0}, "eta_short": 0.0030298448438576234, "excess_long": -0.002584090662309646, "excess_short": 0.0015962739752384259, "excess_short_shift": -2.7158917154651054e-05, "frozen": false, "jump_penalty_effective": null, "jumps": 589, "passes_duration": false, "s1_mean": 0.9880158411779278, "s1_min": 0.9274237874229243, "s2": 0.8466964905044113, "score": 0.0014643517735567642, "stability": 0.9173561658411695, "wcss": 1101259.7356642715}, "reason": "baseline", "status": "kept", "trial_id": "kmeans_k2"}
{"at": "2026-10-05T04:36:59+00:00", "kind": "result", "labels_path": "trials/exp2/labels/kmf_k2.csv", "labels_sha256": "3c38131101a205c410cef26f4f3f9f78a70a7e69cdaa1602ea350bd331e03a9a", "metrics": {"durations": {"0": 3.0, "1": 3.0}, "eta_short": 0.002474925500944704, "excess_long": -0.00484725688065586, "excess_short": 0.0005179451541572383, "excess_short_shift": -0.0011223315567533525, "frozen": true, "jump_penalty_effective": null, "jumps": 589, "passes_duration": false, "s1_mean": null, "s1_min": null, "s2": 0.8466964905044113, "score": 0.0004385423442987, "stability": 0.8466964905044113, "wcss": 1101259.7356642715}, "reason": "fails the minimum median duration", "status": "discarded", "trial_id": "kmf_k2"}
{"at": "2026-10-05T15:44:44+00:00", "kind": "result", "labels_path": "trials/exp2/labels/jm_k3_lam0.5.csv", "labels_sha256": "c02ad4f329e55f63bd95fdbfa4732992657e3d24dffcf3022a2ce39be2b87289", "metrics": {"durations": {"0": 34.0, "1": 19.5, "2": 34.5}, "eta_short": 0.0047173117193360405, "excess_long": -0.006532338951136498, "excess_short": 0.0012321300083422675, "excess_short_shift": -0.0005847191064819873, "frozen": false, "jump_penalty_effective": 69.5, "jumps": 198, "passes_duration": false, "s1_mean": 0.864014641678927, "s1_min": 0.5076221091841712, "s2": 0.7974287905276031, "score": 0.0010235571549924189, "stability": 0.8307217161032651, "wcss": 1009721.7284336956}, "reason": "fails the minimum median duration", "status": "discarded", "trial_id": "jm_k3_lam0.5"}
{"at": "2026-10-05T15:51:13+00:00", "kind": "result", "labels_path": "trials/exp2/labels/jm_k3_lam1.2.csv", "labels_sha256": "4c7c82f9ad85675b5982070a9ede6202a325a0645130a6db122820ddcfb44ca9", "metrics": {"durations": {"0": 41.0, "1": 31.0, "2": 67.0}, "eta_short": 0.0018058724601163806, "excess_long": -0.007046317485705943, "excess_short": -0.0019236240612638836, "excess_short_shift": -0.0037313682808949268, "frozen": false, "jump_penalty_effective": 166.79999999999998, "jumps": 145, "passes_duration": true, "s1_mean": 0.8878893318446834, "s1_min": 0.4635521054187153, "s2": 0.6773293762284589, "score": -0.0015054461839949336, "stability": 0.7826093540365712, "wcss": 1019446.2866154187}, "reason": "", "status": "kept", "trial_id": "jm_k3_lam1.2"}
{"at": "2026-10-05T16:05:40+00:00", "kind": "result", "labels_path": "trials/exp2/labels/jm_k3_lam3.csv", "labels_sha256": "1e11cd488e49b40f17281e2a2899307362a985d384dbb685928ea56efac2786e", "metrics": {"durations": {"0": 74.0, "1": 54.0, "2": 82.0}, "eta_short": 0.001515254593276053, "excess_long": -0.004364075378973949, "excess_short": -0.0023361441444855672, "excess_short_shift": -0.003965319620503446, "frozen": false, "jump_penalty_effective": 417.0, "jumps": 114, "passes_duration": true, "s1_mean": 0.9090835341674255, "s1_min": 0.6815218232559499, "s2": 0.7633528677303899, "score": -0.001953526253659046, "stability": 0.8362182009489076, "wcss": 1036882.5101621436}, "reason": "", "status": "kept", "trial_id": "jm_k3_lam3"}
{"at": "2026-10-05T16:09:16+00:00", "kind": "result", "labels_path": "trials/exp2/labels/jm_k3_lam8.csv", "labels_sha256": "f4d5515452bf66b3b6f4ba25bd07c1b129920922eb2427b1bf74113811b11a04", "metrics": {"durations": {"0": 89.0, "1": 65.0, "2": 96.5}, "eta_short": 0.002772407279006008, "excess_long": -0.006594534298036725, "excess_short": -0.0014348111910399363, "excess_short_shift": -0.0024203791714584645, "frozen": false, "jump_penalty_effective": 1112.0, "jumps": 85, "passes_duration": true, "s1_mean": 0.846256648647478, "s1_min": 0.3440739858211656, "s2": 0.5085714118711843, "score": -0.0009719612315835543, "stability": 0.6774140302593311, "wcss": 1078470.5454578924}, "reason": "", "status": "kept", "trial_id": "jm_k3_lam8"}
{"at": "2026-10-05T16:23:59+00:00", "kind": "result", "labels_path": "trials/exp2/labels/jm_k3_lam20.csv", "labels_sha256": "fae5234fe1fa0572ae293f1c965486738c1a3c5100280e71dd88d09e92c62b96", "metrics": {"durations": {"0": 109.0, "1": 90.5, "2": 109.5}, "eta_short": 2.7688899532881643e-05, "excess_long": -0.007663376643725232, "excess_short": -0.0041639031137904944, "excess_short_shift": -0.005324848907955541, "frozen": false, "jump_penalty_effective": 2780.0, "jumps": 46, "passes_duration": true, "s1_mean": 0.8526998000130289, "s1_min": 0.2887119009876539, "s2": 0.6725465799819892, "score": -0.0031754890754794683, "stability": 0.7626231899975091, "wcss": 1212520.798427559}, "reason": "", "status": "kept", "trial_id": "jm_k3_lam20"}
{"at": "2026-10-05T16:27:00+00:00", "kind": "result", "labels_path": "trials/exp2/labels/jm_k3_lam50.csv", "labels_sha256": "94725b3db2fbba6bbbcfa7d70b38d89dbead4a22ba45f826b4c3d67236aaf1f0", "metrics": {"durations": {"0": 329.0, "1": 70.5, "2": 152.0}, "eta_short": 0.007256511099581096, "excess_long": 0.010639892137655479, "excess_short": 0.0026347639996930636, "excess_short_shift": 0.0033673061682971458, "frozen": false, "jump_penalty_effective": 6950.0, "jumps": 2, "passes_duration": true, "s1_mean": 0.7076280304799868, "s1_min": -0.06258750583620697, "s2": 0.0, "score": 0.0009322164299411876, "stability": 0.3538140152399934, "wcss": 1545031.9112825373}, "reason": "", "status": "kept", "trial_id": "jm_k3_lam50"}
{"at": "2026-10-05T16:27:16+00:00", "kind": "result", "labels_path": "trials/exp2/labels/kmeans_k3.csv", "labels_sha256": "934f54e81656ac21c30cae469d5ddecda889516e3cd3f4523b4422399c13e662", "metrics": {"durations": {"0": 3.0, "1": 3.0, "2": 4.0}, "eta_short": 0.0050282352226987785, "excess_long": -0.005213731452930916, "excess_short": 0.0022787222632868753, "excess_short_shift": 0.0002490479160562574, "frozen": false, "jump_penalty_effective": null, "jumps": 1007, "passes_duration": false, "s1_mean": 0.923489945737693, "s1_min": 0.5445661180231259, "s2": 0.6435050760946689, "score": 0.0017853732213545534, "stability": 0.783497510916181, "wcss": 994507.2929012247}, "reason": "baseline", "status": "kept", "trial_id": "kmeans_k3"}
{"at": "2026-10-05T16:27:19+00:00", "kind": "result", "labels_path": "trials/exp2/labels/kmf_k3.csv", "labels_sha256": "a76b38e670b973586a65cd7c4392ed7fc1c40a3b7bff82708f9341b0c9455d8f", "metrics": {"durations": {"0": 4.0, "1": 3.5, "2": 4.0}, "eta_short": 0.0021848900106430833, "excess_long": -0.006105228126367238, "excess_short": -0.0008967423388857644, "excess_short_shift": -0.00344279171877925, "frozen": true, "jump_penalty_effective": null, "jumps": 1007, "passes_duration": false, "s1_mean": null, "s1_min": null, "s2": 0.6435050760946689, "score": -0.0005770582470219952, "stability": 0.6435050760946689, "wcss": 994507.2929012247}, "reason": "fails the minimum median duration", "status": "discarded", "trial_id": "kmf_k3"}
{"at": "2026-10-05T16:47:05+00:00", "kind": "result", "labels_path": "trials/exp2/labels/jm_k4_lam0.5.csv", "labels_sha256": "fc389fd2ff076ce6f9dfd344162804ea22c314708f46c770b0bc9e1ef0108a97", "metrics": {"durations": {"0": 27.0, "1": 17.0, "2": 18.0, "3": 27.0}, "eta_short": 0.010218758533510073, "excess_long": 0.007764955519655522, "excess_short": 0.0050277894299029825, "excess_short_shift": 0.0028083584162557637, "frozen": false, "jump_penalty_effective": 69.5, "jumps": 256, "passes_duration": false, "s1_mean": 0.9384715892319233, "s1_min": 0.5593751926364433, "s2": 0.6002866769136289, "score": 0.003868276272851224, "stability": 0.7693791330727762, "wcss": 925674.6992276681}, "reason": "fails the minimum median duration", "status": "discarded", "trial_id": "jm_k4_lam0.5"}
{"at": "2026-10-05T16:53:17+00:00", "kind": "result", "labels_path": "trials/exp2/labels/jm_k4_lam1.2.csv", "labels_sha256": "23124700196821c82f29d648b416e761762e969bd14913805c8b5094d7437365", "metrics": {"durations": {"0": 37.0, "1": 39.0, "2": 24.0, "3": 36.5}, "eta_short": 0.010443137840354218, "excess_long": 0.0032447086887947268, "excess_short": 0.004839252426911702, "excess_short_shift": 0.002752710259280501, "frozen": false, "jump_penalty_effective": 166.79999999999998, "jumps": 173, "passes_duration": true, "s1_mean": 0.86156663644054, "s1_min": 0.5255401803516538, "s2": 0.36661306116753933, "score": 0.002971735791166789, "stability": 0.6140898488040396, "wcss": 944353.375755976}, "reason": "", "status": "kept", "trial_id": "jm_k4_lam1.2"}
{"at": "2026-10-05T16:58:08+00:00", "kind": "result", "labels_path": "trials/exp2/labels/jm_k4_lam3.csv", "labels_sha256": "456b0c843ee42165a72a7284055e228564314adfb5be217dd4117ad0d987ecdd", "metrics": {"durations": {"0": 45.0, "1": 46.0, "2": 34.0, "3": 44.5}, "eta_short": 0.019360418921948737, "excess_long": 0.001710025277286328, "excess_short": 0.014005419630160157, "excess_short_shift": 0.01162736103345409, "frozen": false, "jump_penalty_effective": 417.0, "jumps": 134, "passes_duration": true, "s1_mean": 0.778356186393404, "s1_min": 0.40888212735988483, "s2": 0.3545935894910687, "score": 0.007933718515578971, "stability": 0.5664748879422363, "wcss": 963573.2054290646}, "reason": "", "status": "kept", "trial_id": "jm_k4_lam3"}
{"at": "2026-10-05T17:01:53+00:00", "kind": "result", "labels_path": "trials/exp2/labels/jm_k4_lam8.csv", "labels_sha256": "405dfc4be89362301009ec8694d0401ba51225f10619c7fc23ac5efb8a12b4cc", "metrics": {"durations": {"0": 57.0, "1": 91.0, "2": 55.0, "3": 58.0}, "eta_short": 0.001144222140911221, "excess_long": -0.012856350439429854, "excess_short": -0.005024853692363208, "excess_short_shift": -0.006221389980434453, "frozen": false, "jump_penalty_effective": 1112.0, "jumps": 87, "passes_duration": true, "s1_mean": 0.6985565773667352, "s1_min": 0.380090605149333, "s2": 0.35164227619328786, "score": -0.0026385477935133446, "stability": 0.5250994267800115, "wcss": 1035739.0309189659}, "reason": "", "status": "kept", "trial_id": "jm_k4_lam8"}
{"at": "2026-10-05T17:04:57+00:00", "kind": "result", "labels_path": "trials/exp2/labels/jm_k4_lam20.csv", "labels_sha256": "0081d5da226c6932ad026a2b3b03b2f28f99e129a64f2e4a9bbcda2764a73e2c", "metrics": {"durations": {"0": 88.0, "1": 59.0, "2": 86.0, "3": 74.5}, "eta_short": 0.013858653636022315, "excess_long": 0.03436250658265489, "excess_short": 0.00803800630021376, "excess_short_shift": 0.006833719236194321, "frozen": false, "jump_penalty_effective": 2780.0, "jumps": 49, "passes_duration": true, "s1_mean": 0.6214153266045568, "s1_min": 0.1785713909498769, "s2": 0.48403034583801996, "score": 0.004442789639818734, "stability": 0.5527228362212884, "wcss": 1169518.5945061673}, "reason": "", "status": "kept", "trial_id": "jm_k4_lam20"}
{"at": "2026-10-05T17:06:32+00:00", "kind": "result", "labels_path": "trials/exp2/labels/jm_k4_lam50.csv", "labels_sha256": "afb4a40e88ee0684c944496d18f1dd3d4091c5738ff501f29e63ab0dfb5ba5c1", "metrics": {"durations": {"0": 389.0, "1": 70.5, "2": 182.5, "3": 35.0}, "eta_short": 0.00550275513536729, "excess_long": 0.007706009439330584, "excess_short": 0.0013737266348316894, "excess_short_shift": -0.0003966143472512807, "frozen": false, "jump_penalty_effective": 6950.0, "jumps": 3, "passes_duration": true, "s1_mean": 0.7039398196523593, "s1_min": -0.06258750583620697, "s2": 0.0, "score": 0.0004835104397875309, "stability": 0.35196990982617965, "wcss": 1530302.9662221689}, "reason": "", "status": "kept", "trial_id": "jm_k4_lam50"}
{"at": "2026-10-05T17:06:52+00:00", "kind": "result", "labels_path": "trials/exp2/labels/kmeans_k4.csv", "labels_sha256": "e43c3210d1b8ce3959ef44a5f5c6839b233cdb4dcf59a0b6d070260746032ad3", "metrics": {"durations": {"0": 3.0, "1": 3.0, "2": 3.0, "3": 3.0}, "eta_short": 0.009635237005273111, "excess_long": 0.006714477449814746, "excess_short": 0.005241599170240375, "excess_short_shift": 0.0026836042444208386, "frozen": false, "jump_penalty_effective": null, "jumps": 1087, "passes_duration": false, "s1_mean": 0.9724596842581641, "s1_min": 0.4954161232127733, "s2": 0.6435107348466523, "score": 0.0042351346039563986, "stability": 0.8079852095524083, "wcss": 912672.868213119}, "reason": "baseline", "status": "kept", "trial_id": "kmeans_k4"}
{"at": "2026-10-05T17:06:55+00:00", "kind": "result", "labels_path": "trials/exp2/labels/kmf_k4.csv", "labels_sha256": "bfc61e04ae0d6485a7bc819b29fcacc2122a0bb323e593e897e728ce5ac6fe60", "metrics": {"durations": {"0": 3.0, "1": 3.0, "2": 2.0, "3": 3.0}, "eta_short": 0.009027906118178374, "excess_long": 0.0003677546010701256, "excess_short": 0.0038032842963044954, "excess_short_shift": 1.0687861947680441e-05, "frozen": true, "jump_penalty_effective": null, "jumps": 1087, "passes_duration": false, "s1_mean": null, "s1_min": null, "s2": 0.6435107348466523, "score": 0.0024474542723456386, "stability": 0.6435107348466523, "wcss": 912672.868213119}, "reason": "fails the minimum median duration", "status": "discarded", "trial_id": "kmf_k4"}
{"at": "2026-10-05T17:14:09+00:00", "kind": "result", "labels_path": "trials/exp2/labels/jm_k5_lam0.5.csv", "labels_sha256": "80ef89cb6d19574c72abef516f1f18f77c0b47a5eca091b7f7d590e6b4018725", "metrics": {"durations": {"0": 16.5, "1": 29.0, "2": 18.0, "3": 15.0, "4": 26.0}, "eta_short": 0.0087081625313493, "excess_long": 0.008465295044728899, "excess_short": 0.002098564859046131, "excess_short_shift": -0.0005561296629944101, "frozen": false, "jump_penalty_effective": 69.5, "jumps": 268, "passes_duration": false, "s1_mean": 0.7982018233682642, "s1_min": 0.4499413749790104, "s2": 0.6474980496129839, "score": 0.001516947475082951, "stability": 0.722849936490624, "wcss": 875049.2694507944}, "reason": "fails the minimum median duration", "status": "discarded", "trial_id": "jm_k5_lam0.5"}
{"at": "2026-10-05T17:22:10+00:00", "kind": "result", "labels_path": "trials/exp2/labels/jm_k5_lam1.2.csv", "labels_sha256": "7ae3ca321cb437d59bccd848d136b12b8d5a2c9fbc5f65629d932548a4ec4531", "metrics": {"durations": {"0": 41.0, "1": 33.0, "2": 20.5, "3": 22.0, "4": 45.0}, "eta_short": 0.006262225750253835, "excess_long": 0.013381931302531729, "excess_short": -0.0002680473767798317, "excess_short_shift": -0.0038560460603292218, "frozen": false, "jump_penalty_effective": 166.79999999999998, "jumps": 195, "passes_duration": true, "s1_mean": 0.7830414141254343, "s1_min": 0.4565956319071139, "s2": 0.40480958596926564, "score": -0.00015920017229034198, "stability": 0.59392550004735, "wcss": 891509.652912691}, "reason": "", "status": "kept", "trial_id": "jm_k5_lam1.2"}
{"at": "2026-10-05T17:27:24+00:00", "kind": "result", "labels_path": "trials/exp2/labels/jm_k5_lam3.csv", "labels_sha256": "9a1d05d5bfd2b953693fbe0808e0146753b09efb0512f60d978411b37a23474d", "metrics": {"durations": {"0": 40.0, "1": 37.5, "2": 33.0, "3": 35.0, "4": 48.0}, "eta_short": 0.014830890981964035, "excess_long": -0.001168698355892412, "excess_short": 0.00790986402092484, "excess_short_shift": 0.00515800982140324, "frozen": false, "jump_penalty_effective": 417.0, "jumps": 146, "passes_duration": true, "s1_mean": 0.7534747740070311, "s1_min": 0.4605171544590631, "s2": 0.5169867254637374, "score": 0.005024588852317027, "stability": 0.6352307497353842, "wcss": 912409.3228401958}, "reason": "", "status": "kept", "trial_id": "jm_k5_lam3"}
{"at": "2026-10-05T17:31:16+00:00", "kind": "result", "labels_path": "trials/exp2/labels/jm_k5_lam8.csv", "labels_sha256": "7a8ae87c8ca302b510e2a8feb4b4b016bc7b6f43cee1cfdfa5c4892d210ece0c", "metrics": {"durations": {"0": 41.5, "1": 62.5, "2": 61.0, "3": 43.0, "4": 70.0}, "eta_short": 0.006013017169580342, "excess_long": -0.002721264669623802, "excess_short": -0.001929298462348605, "excess_short_shift": -0.0035305559459707196, "frozen": false, "jump_penalty_effective": 1112.0, "jumps": 100, "passes_duration": true, "s1_mean": 0.7049725516966436, "s1_min": 0.42050103320298726, "s2": 0.3751680365327817, "score": -0.001041956787995674, "stability": 0.5400702941147126, "wcss": 976698.4633910567}, "reason": "", "status": "kept", "trial_id": "jm_k5_lam8"}
{"at": "2026-10-05T17:34:14+00:00", "kind": "result", "labels_path": "trials/exp2/labels/jm_k5_lam20.csv", "labels_sha256": "b5636a4951dbfc19c8abdebed23142728f97fd4916daf2cf7a1d240d52f77c9e", "metrics": {"durations": {"0": 50.0, "1": 78.0, "2": 63.5, "3": 53.5, "4": 59.0}, "eta_short": 0.007015279185372234, "excess_long": -0.005818726823033778, "excess_short": -0.0017603584890679286, "excess_short_shift": -0.0017446897110190047, "frozen": false, "jump_penalty_effective": 2780.0, "jumps": 49, "passes_duration": true, "s1_mean": 0.5472651938480596, "s1_min": 0.2596447225080282, "s2": 0.40682302183320296, "score": -0.0008397686448970916, "stability": 0.4770441078406313, "wcss": 1156417.393751688}, "reason": "", "status": "kept", "trial_id": "jm_k5_lam20"}
{"at": "2026-10-05T17:35:53+00:00", "kind": "result", "labels_path": "trials/exp2/labels/jm_k5_lam50.csv", "labels_sha256": "903954104b7e5e073cc9b95b198cc0159429b0fb41ccee184a52ab09d69d4897", "metrics": {"durations": {"0": 266.5, "1": 49.0, "2": 566.0, "3": 217.0, "4": NaN}, "eta_short": 0.013714119132577472, "excess_long": 0.018265456964276217, "excess_short": 0.006849783126877408, "excess_short_shift": 0.007383816518474368, "frozen": false, "jump_penalty_effective": 6950.0, "jumps": 3, "passes_duration": false, "s1_mean": 0.7040311041945894, "s1_min": -0.06258750583620697, "s2": 0.0, "score": 0.002411230189154484, "stability": 0.3520155520972947, "wcss": 1530346.2465107166}, "reason": "fails the minimum median duration", "status": "discarded", "trial_id": "jm_k5_lam50"}
{"at": "2026-10-05T17:36:16+00:00", "kind": "result", "labels_path": "trials/exp2/labels/kmeans_k5.csv", "labels_sha256": "2c0cd06c50eabedde7842b880a085f73b050d0e089518648d0f828fc007a3ece", "metrics": {"durations": {"0": 3.0, "1": 3.0, "2": 3.0, "3": 2.0, "4": 3.0}, "eta_short": 0.00969901400978585, "excess_long": 0.0010651557564105123, "excess_short": 0.0038146467318667682, "excess_short_shift": 0.0010918467377391671, "frozen": false, "jump_penalty_effective": null, "jumps": 1192, "passes_duration": false, "s1_mean": 0.9001561357511013, "s1_min": 0.4546971082913132, "s2": 0.44171453167285707, "score": 0.002559381278038341, "stability": 0.6709353337119792, "wcss": 859711.7006868065}, "reason": "baseline", "status": "kept", "trial_id": "kmeans_k5"}
