{"at": "2026-10-02T20:07:04+00:00", "code_commit": "7d143ef52f04dc544d6eba9ce168f563231a5104.b626a8ad6de4b5a8f9f83d76ae6baeb0c932369e.3442ea8a6c7155325a9d87b9dab685b8d9969538", "config": {"columns": ["S", "C", "dL21", "dL63", "dS21", "dS63", "dC63", "logvol5_60", "logr5_20_60", "logr5_60_120"], "config": {"bootstrap": {"block_weeks": 26, "n_resamples": 2000, "seed": 0}, "burn_in_days": 252, "effective_n_cut": 0.2, "first_train_end": "1987-12-31", "ftic": {"k0": 3, "max_jump_fraction": 0.4, "mean_phase_days": 40, "saturated_k": 6}, "holdout_start": "2024-10-01", "horizon_long_days": 65, "horizon_short_days": 20, "jump_penalties": [5.0, 12.0, 30.0, 80.0, 200.0, 500.0], "k_values": [2, 3, 4, 5], "pbo_blocks": 16, "refit_weeks": 26, "series": ["DGS1", "DGS2", "DGS3", "DGS5", "DGS7", "DGS10", "DGS30"], "start": "1977-02-15", "thresholds": {"collinearity_max": 0.8, "independence_p_max": 0.01, "min_median_duration_days": 20, "pbo_max": 0.05, "stability_min": 0.6}}, "environment": {"jumpmodels": "0.1.1", "numpy": "2.5.3", "pandas": "3.0.6", "python": "3.14.2", "scikit-learn": "1.9.1", "scipy": "1.18.1"}}, "hypothesis": "Feature set fixed on the first training window; every parameter fixed in advance.", "kind": "registered", "snapshot_hash": "402c4c41fb184462bc47d8d7e1d04743b713e9a0bab0a6c71925f4227623b1dd", "trial_id": "setup"}
{"at": "2026-10-02T20:07:04+00:00", "code_commit": "7d143ef52f04dc544d6eba9ce168f563231a5104.b626a8ad6de4b5a8f9f83d76ae6baeb0c932369e.3442ea8a6c7155325a9d87b9dab685b8d9969538", "config": {"jump_penalty": 5.0, "model": "jump", "n_states": 2}, "hypothesis": "A jump model with 2 states and penalty 5 gives stable regimes that separate the forward 10Y move.", "kind": "registered", "snapshot_hash": "402c4c41fb184462bc47d8d7e1d04743b713e9a0bab0a6c71925f4227623b1dd", "trial_id": "jm_k2_lam5"}
{"at": "2026-10-02T20:07:04+00:00", "code_commit": "7d143ef52f04dc544d6eba9ce168f563231a5104.b626a8ad6de4b5a8f9f83d76ae6baeb0c932369e.3442ea8a6c7155325a9d87b9dab685b8d9969538", "config": {"jump_penalty": 12.0, "model": "jump", "n_states": 2}, "hypothesis": "A jump model with 2 states and penalty 12 gives stable regimes that separate the forward 10Y move.", "kind": "registered", "snapshot_hash": "402c4c41fb184462bc47d8d7e1d04743b713e9a0bab0a6c71925f4227623b1dd", "trial_id": "jm_k2_lam12"}
{"at": "2026-10-02T20:07:04+00:00", "code_commit": "7d143ef52f04dc544d6eba9ce168f563231a5104.b626a8ad6de4b5a8f9f83d76ae6baeb0c932369e.3442ea8a6c7155325a9d87b9dab685b8d9969538", "config": {"jump_penalty": 30.0, "model": "jump", "n_states": 2}, "hypothesis": "A jump model with 2 states and penalty 30 gives stable regimes that separate the forward 10Y move.", "kind": "registered", "snapshot_hash": "402c4c41fb184462bc47d8d7e1d04743b713e9a0bab0a6c71925f4227623b1dd", "trial_id": "jm_k2_lam30"}
{"at": "2026-10-02T20:07:04+00:00", "code_commit": "7d143ef52f04dc544d6eba9ce168f563231a5104.b626a8ad6de4b5a8f9f83d76ae6baeb0c932369e.3442ea8a6c7155325a9d87b9dab685b8d9969538", "config": {"jump_penalty": 80.0, "model": "jump", "n_states": 2}, "hypothesis": "A jump model with 2 states and penalty 80 gives stable regimes that separate the forward 10Y move.", "kind": "registered", "snapshot_hash": "402c4c41fb184462bc47d8d7e1d04743b713e9a0bab0a6c71925f4227623b1dd", "trial_id": "jm_k2_lam80"}
{"at": "2026-10-02T20:07:04+00:00", "code_commit": "7d143ef52f04dc544d6eba9ce168f563231a5104.b626a8ad6de4b5a8f9f83d76ae6baeb0c932369e.3442ea8a6c7155325a9d87b9dab685b8d9969538", "config": {"jump_penalty": 200.0, "model": "jump", "n_states": 2}, "hypothesis": "A jump model with 2 states and penalty 200 gives stable regimes that separate the forward 10Y move.", "kind": "registered", "snapshot_hash": "402c4c41fb184462bc47d8d7e1d04743b713e9a0bab0a6c71925f4227623b1dd", "trial_id": "jm_k2_lam200"}
{"at": "2026-10-02T20:07:04+00:00", "code_commit": "7d143ef52f04dc544d6eba9ce168f563231a5104.b626a8ad6de4b5a8f9f83d76ae6baeb0c932369e.3442ea8a6c7155325a9d87b9dab685b8d9969538", "config": {"jump_penalty": 500.0, "model": "jump", "n_states": 2}, "hypothesis": "A jump model with 2 states and penalty 500 gives stable regimes that separate the forward 10Y move.", "kind": "registered", "snapshot_hash": "402c4c41fb184462bc47d8d7e1d04743b713e9a0bab0a6c71925f4227623b1dd", "trial_id": "jm_k2_lam500"}
{"at": "2026-10-02T20:07:04+00:00", "code_commit": "7d143ef52f04dc544d6eba9ce168f563231a5104.b626a8ad6de4b5a8f9f83d76ae6baeb0c932369e.3442ea8a6c7155325a9d87b9dab685b8d9969538", "config": {"model": "kmeans", "n_states": 2}, "hypothesis": "Baseline: the same model without a jump penalty.", "kind": "registered", "snapshot_hash": "402c4c41fb184462bc47d8d7e1d04743b713e9a0bab0a6c71925f4227623b1dd", "trial_id": "kmeans_k2"}
{"at": "2026-10-02T20:07:04+00:00", "code_commit": "7d143ef52f04dc544d6eba9ce168f563231a5104.b626a8ad6de4b5a8f9f83d76ae6baeb0c932369e.3442ea8a6c7155325a9d87b9dab685b8d9969538", "config": {"jump_penalty": 5.0, "model": "jump", "n_states": 3}, "hypothesis": "A jump model with 3 states and penalty 5 gives stable regimes that separate the forward 10Y move.", "kind": "registered", "snapshot_hash": "402c4c41fb184462bc47d8d7e1d04743b713e9a0bab0a6c71925f4227623b1dd", "trial_id": "jm_k3_lam5"}
{"at": "2026-10-02T20:07:04+00:00", "code_commit": "7d143ef52f04dc544d6eba9ce168f563231a5104.b626a8ad6de4b5a8f9f83d76ae6baeb0c932369e.3442ea8a6c7155325a9d87b9dab685b8d9969538", "config": {"jump_penalty": 12.0, "model": "jump", "n_states": 3}, "hypothesis": "A jump model with 3 states and penalty 12 gives stable regimes that separate the forward 10Y move.", "kind": "registered", "snapshot_hash": "402c4c41fb184462bc47d8d7e1d04743b713e9a0bab0a6c71925f4227623b1dd", "trial_id": "jm_k3_lam12"}
{"at": "2026-10-02T20:07:04+00:00", "code_commit": "7d143ef52f04dc544d6eba9ce168f563231a5104.b626a8ad6de4b5a8f9f83d76ae6baeb0c932369e.3442ea8a6c7155325a9d87b9dab685b8d9969538", "config": {"jump_penalty": 30.0, "model": "jump", "n_states": 3}, "hypothesis": "A jump model with 3 states and penalty 30 gives stable regimes that separate the forward 10Y move.", "kind": "registered", "snapshot_hash": "402c4c41fb184462bc47d8d7e1d04743b713e9a0bab0a6c71925f4227623b1dd", "trial_id": "jm_k3_lam30"}
{"at": "2026-10-02T20:07:04+00:00", "code_commit": "7d143ef52f04dc544d6eba9ce168f563231a5104.b626a8ad6de4b5a8f9f83d76ae6baeb0c932369e.3442ea8a6c7155325a9d87b9dab685b8d9969538", "config": {"jump_penalty": 80.0, "model": "jump", "n_states": 3}, "hypothesis": "A jump model with 3 states and penalty 80 gives stable regimes that separate the forward 10Y move.", "kind": "registered", "snapshot_hash": "402c4c41fb184462bc47d8d7e1d04743b713e9a0bab0a6c71925f4227623b1dd", "trial_id": "jm_k3_lam80"}
{"at": "2026-10-02T20:07:04+00:00", "code_commit": "7d143ef52f04dc544d6eba9ce168f563231a5104.b626a8ad6de4b5a8f9f83d76ae6baeb0c932369e.3442ea8a6c7155325a9d87b9dab685b8d9969538", "config": {"jump_penalty": 200.0, "model": "jump", "n_states": 3}, "hypothesis": "A jump model with 3 states and penalty 200 gives stable regimes that separate the forward 10Y move.", "kind": "registered", "snapshot_hash": "402c4c41fb184462bc47d8d7e1d04743b713e9a0bab0a6c71925f4227623b1dd", "trial_id": "jm_k3_lam200"}
{"at": "2026-10-02T20:07:04+00:00", "code_commit": "7d143ef52f04dc544d6eba9ce168f563231a5104.b626a8ad6de4b5a8f9f83d76ae6baeb0c932369e.3442ea8a6c7155325a9d87b9dab685b8d9969538", "config": {"jump_penalty": 500.0, "model": "jump", "n_states": 3}, "hypothesis": "A jump model with 3 states and penalty 500 gives stable regimes that separate the forward 10Y move.", "kind": "registered", "snapshot_hash": "402c4c41fb184462bc47d8d7e1d04743b713e9a0bab0a6c71925f4227623b1dd", "trial_id": "jm_k3_lam500"}
{"at": "2026-10-02T20:07:04+00:00", "code_commit": "7d143ef52f04dc544d6eba9ce168f563231a5104.b626a8ad6de4b5a8f9f83d76ae6baeb0c932369e.3442ea8a6c7155325a9d87b9dab685b8d9969538", "config": {"model": "kmeans", "n_states": 3}, "hypothesis": "Baseline: the same model without a jump penalty.", "kind": "registered", "snapshot_hash": "402c4c41fb184462bc47d8d7e1d04743b713e9a0bab0a6c71925f4227623b1dd", "trial_id": "kmeans_k3"}
{"at": "2026-10-02T20:07:04+00:00", "code_commit": "7d143ef52f04dc544d6eba9ce168f563231a5104.b626a8ad6de4b5a8f9f83d76ae6baeb0c932369e.3442ea8a6c7155325a9d87b9dab685b8d9969538", "config": {"jump_penalty": 5.0, "model": "jump", "n_states": 4}, "hypothesis": "A jump model with 4 states and penalty 5 gives stable regimes that separate the forward 10Y move.", "kind": "registered", "snapshot_hash": "402c4c41fb184462bc47d8d7e1d04743b713e9a0bab0a6c71925f4227623b1dd", "trial_id": "jm_k4_lam5"}
{"at": "2026-10-02T20:07:04+00:00", "code_commit": "7d143ef52f04dc544d6eba9ce168f563231a5104.b626a8ad6de4b5a8f9f83d76ae6baeb0c932369e.3442ea8a6c7155325a9d87b9dab685b8d9969538", "config": {"jump_penalty": 12.0, "model": "jump", "n_states": 4}, "hypothesis": "A jump model with 4 states and penalty 12 gives stable regimes that separate the forward 10Y move.", "kind": "registered", "snapshot_hash": "402c4c41fb184462bc47d8d7e1d04743b713e9a0bab0a6c71925f4227623b1dd", "trial_id": "jm_k4_lam12"}
{"at": "2026-10-02T20:07:04+00:00", "code_commit": "7d143ef52f04dc544d6eba9ce168f563231a5104.b626a8ad6de4b5a8f9f83d76ae6baeb0c932369e.3442ea8a6c7155325a9d87b9dab685b8d9969538", "config": {"jump_penalty": 30.0, "model": "jump", "n_states": 4}, "hypothesis": "A jump model with 4 states and penalty 30 gives stable regimes that separate the forward 10Y move.", "kind": "registered", "snapshot_hash": "402c4c41fb184462bc47d8d7e1d04743b713e9a0bab0a6c71925f4227623b1dd", "trial_id": "jm_k4_lam30"}
{"at": "2026-10-02T20:07:04+00:00", "code_commit": "7d143ef52f04dc544d6eba9ce168f563231a5104.b626a8ad6de4b5a8f9f83d76ae6baeb0c932369e.3442ea8a6c7155325a9d87b9dab685b8d9969538", "config": {"jump_penalty": 80.0, "model": "jump", "n_states": 4}, "hypothesis": "A jump model with 4 states and penalty 80 gives stable regimes that separate the forward 10Y move.", "kind": "registered", "snapshot_hash": "402c4c41fb184462bc47d8d7e1d04743b713e9a0bab0a6c71925f4227623b1dd", "trial_id": "jm_k4_lam80"}
{"at": "2026-10-02T20:07:04+00:00", "code_commit": "7d143ef52f04dc544d6eba9ce168f563231a5104.b626a8ad6de4b5a8f9f83d76ae6baeb0c932369e.3442ea8a6c7155325a9d87b9dab685b8d9969538", "config": {"jump_penalty": 200.0, "model": "jump", "n_states": 4}, "hypothesis": "A jump model with 4 states and penalty 200 gives stable regimes that separate the forward 10Y move.", "kind": "registered", "snapshot_hash": "402c4c41fb184462bc47d8d7e1d04743b713e9a0bab0a6c71925f4227623b1dd", "trial_id": "jm_k4_lam200"}
{"at": "2026-10-02T20:07:04+00:00", "code_commit": "7d143ef52f04dc544d6eba9ce168f563231a5104.b626a8ad6de4b5a8f9f83d76ae6baeb0c932369e.3442ea8a6c7155325a9d87b9dab685b8d9969538", "config": {"jump_penalty": 500.0, "model": "jump", "n_states": 4}, "hypothesis": "A jump model with 4 states and penalty 500 gives stable regimes that separate the forward 10Y move.", "kind": "registered", "snapshot_hash": "402c4c41fb184462bc47d8d7e1d04743b713e9a0bab0a6c71925f4227623b1dd", "trial_id": "jm_k4_lam500"}
{"at": "2026-10-02T20:07:04+00:00", "code_commit": "7d143ef52f04dc544d6eba9ce168f563231a5104.b626a8ad6de4b5a8f9f83d76ae6baeb0c932369e.3442ea8a6c7155325a9d87b9dab685b8d9969538", "config": {"model": "kmeans", "n_states": 4}, "hypothesis": "Baseline: the same model without a jump penalty.", "kind": "registered", "snapshot_hash": "402c4c41fb184462bc47d8d7e1d04743b713e9a0bab0a6c71925f4227623b1dd", "trial_id": "kmeans_k4"}
{"at": "2026-10-02T20:07:04+00:00", "code_commit": "7d143ef52f04dc544d6eba9ce168f563231a5104.b626a8ad6de4b5a8f9f83d76ae6baeb0c932369e.3442ea8a6c7155325a9d87b9dab685b8d9969538", "config": {"jump_penalty": 5.0, "model": "jump", "n_states": 5}, "hypothesis": "A jump model with 5 states and penalty 5 gives stable regimes that separate the forward 10Y move.", "kind": "registered", "snapshot_hash": "402c4c41fb184462bc47d8d7e1d04743b713e9a0bab0a6c71925f4227623b1dd", "trial_id": "jm_k5_lam5"}
{"at": "2026-10-02T20:07:04+00:00", "code_commit": "7d143ef52f04dc544d6eba9ce168f563231a5104.b626a8ad6de4b5a8f9f83d76ae6baeb0c932369e.3442ea8a6c7155325a9d87b9dab685b8d9969538", "config": {"jump_penalty": 12.0, "model": "jump", "n_states": 5}, "hypothesis": "A jump model with 5 states and penalty 12 gives stable regimes that separate the forward 10Y move.", "kind": "registered", "snapshot_hash": "402c4c41fb184462bc47d8d7e1d04743b713e9a0bab0a6c71925f4227623b1dd", "trial_id": "jm_k5_lam12"}
{"at": "2026-10-02T20:07:04+00:00", "code_commit": "7d143ef52f04dc544d6eba9ce168f563231a5104.b626a8ad6de4b5a8f9f83d76ae6baeb0c932369e.3442ea8a6c7155325a9d87b9dab685b8d9969538", "config": {"jump_penalty": 30.0, "model": "jump", "n_states": 5}, "hypothesis": "A jump model with 5 states and penalty 30 gives stable regimes that separate the forward 10Y move.", "kind": "registered", "snapshot_hash": "402c4c41fb184462bc47d8d7e1d04743b713e9a0bab0a6c71925f4227623b1dd", "trial_id": "jm_k5_lam30"}
{"at": "2026-10-02T20:07:04+00:00", "code_commit": "7d143ef52f04dc544d6eba9ce168f563231a5104.b626a8ad6de4b5a8f9f83d76ae6baeb0c932369e.3442ea8a6c7155325a9d87b9dab685b8d9969538", "config": {"jump_penalty": 80.0, "model": "jump", "n_states": 5}, "hypothesis": "A jump model with 5 states and penalty 80 gives stable regimes that separate the forward 10Y move.", "kind": "registered", "snapshot_hash": "402c4c41fb184462bc47d8d7e1d04743b713e9a0bab0a6c71925f4227623b1dd", "trial_id": "jm_k5_lam80"}
{"at": "2026-10-02T20:07:04+00:00", "code_commit": "7d143ef52f04dc544d6eba9ce168f563231a5104.b626a8ad6de4b5a8f9f83d76ae6baeb0c932369e.3442ea8a6c7155325a9d87b9dab685b8d9969538", "config": {"jump_penalty": 200.0, "model": "jump", "n_states": 5}, "hypothesis": "A jump model with 5 states and penalty 200 gives stable regimes that separate the forward 10Y move.", "kind": "registered", "snapshot_hash": "402c4c41fb184462bc47d8d7e1d04743b713e9a0bab0a6c71925f4227623b1dd", "trial_id": "jm_k5_lam200"}
{"at": "2026-10-02T20:07:04+00:00", "code_commit": "7d143ef52f04dc544d6eba9ce168f563231a5104.b626a8ad6de4b5a8f9f83d76ae6baeb0c932369e.3442ea8a6c7155325a9d87b9dab685b8d9969538", "config": {"jump_penalty": 500.0, "model": "jump", "n_states": 5}, "hypothesis": "A jump model with 5 states and penalty 500 gives stable regimes that separate the forward 10Y move.", "kind": "registered", "snapshot_hash": "402c4c41fb184462bc47d8d7e1d04743b713e9a0bab0a6c71925f4227623b1dd", "trial_id": "jm_k5_lam500"}
{"at": "2026-10-02T20:07:04+00:00", "code_commit": "7d143ef52f04dc544d6eba9ce168f563231a5104.b626a8ad6de4b5a8f9f83d76ae6baeb0c932369e.3442ea8a6c7155325a9d87b9dab685b8d9969538", "config": {"model": "kmeans", "n_states": 5}, "hypothesis": "Baseline: the same model without a jump penalty.", "kind": "registered", "snapshot_hash": "402c4c41fb184462bc47d8d7e1d04743b713e9a0bab0a6c71925f4227623b1dd", "trial_id": "kmeans_k5"}
{"at": "2026-10-02T20:07:04+00:00", "code_commit": "7d143ef52f04dc544d6eba9ce168f563231a5104.b626a8ad6de4b5a8f9f83d76ae6baeb0c932369e.3442ea8a6c7155325a9d87b9dab685b8d9969538", "config": {"model": "inertia"}, "hypothesis": "Baseline: sign of the smoothed 63-day change of the level.", "kind": "registered", "snapshot_hash": "402c4c41fb184462bc47d8d7e1d04743b713e9a0bab0a6c71925f4227623b1dd", "trial_id": "inertia"}
{"at": "2026-10-02T20:12:05+00:00", "kind": "result", "labels_path": "trials/labels/jm_k2_lam5.csv", "labels_sha256": "b4bb84012b9b0aee1af8ae6a796db7cebe9a56edc3b12c602e386dd834320ae1", "metrics": {"durations": {"0": 83.5, "1": 69.0}, "eta_short": 0.0028637527871179153, "excess_long": 0.0030877731829246973, "excess_short": 0.00016829070773637664, "excess_short_shift": 0.0008444144899593838, "jumps": 24, "passes_duration": true, "s1_mean": 0.9066291701076993, "s1_min": 0.23335400115221472, "s2": 0.12498484469706383, "score": 8.680552633112925e-05, "stability": 0.5158070074023815, "wcss": 100970.12490454105}, "reason": "", "status": "kept", "trial_id": "jm_k2_lam5"}
{"at": "2026-10-02T20:24:42+00:00", "kind": "result", "labels_path": "trials/labels/jm_k2_lam12.csv", "labels_sha256": "b87654d1196f00c01ccd81ce9a306a224934af9c9024428faa8f3bf5573ea7b7", "metrics": {"durations": {"0": 115.0, "1": 86.0}, "eta_short": 0.002792426064596327, "excess_long": 0.0037130066770376027, "excess_short": 0.00022896684673526756, "excess_short_shift": 0.0008537774169442252, "jumps": 24, "passes_duration": true, "s1_mean": 0.8860349968381505, "s1_min": 0.3445514616994553, "s2": 0.09387212401992326, "score": 0.00011218312177815393, "stability": 0.48995356042903687, "wcss": 100971.56338684217}, "reason": "", "status": "kept", "trial_id": "jm_k2_lam12"}
{"at": "2026-10-02T20:28:16+00:00", "kind": "result", "labels_path": "trials/labels/jm_k2_lam30.csv", "labels_sha256": "a4c756775440d41c914a9a764efe9535cfd1243e9e95e23e8f4917a04e1c24eb", "metrics": {"durations": {"0": 392.0, "1": 414.0}, "eta_short": 0.0018100910071484426, "excess_long": -0.0010718783964521698, "excess_short": -0.0006346021015439115, "excess_short_shift": -0.00020063095420374275, "jumps": 10, "passes_duration": true, "s1_mean": 0.9031831107569768, "s1_min": 0.5885753874249696, "s2": 0.041876756799979216, "score": -0.00029986848901822745, "stability": 0.472529933778478, "wcss": 101557.93897616031}, "reason": "", "status": "kept", "trial_id": "jm_k2_lam30"}
{"at": "2026-10-02T20:32:07+00:00", "kind": "result", "labels_path": "trials/labels/jm_k2_lam80.csv", "labels_sha256": "10ca2c02704aa299b8b6ebe8053390eb1e094fdf8efa7ca77a84938ab4e17404", "metrics": {"durations": {"0": 249.0, "1": 503.5}, "eta_short": 9.971129636412443e-09, "excess_long": -0.005215379449418133, "excess_short": -0.0022927730534945834, "excess_short_shift": -0.00202153567113988, "jumps": 10, "passes_duration": true, "s1_mean": 0.7851611070018865, "s1_min": -0.023434682610433803, "s2": 0.0441184727391592, "score": -0.0009506749371217912, "stability": 0.41463978987052286, "wcss": 101557.93897616031}, "reason": "", "status": "kept", "trial_id": "jm_k2_lam80"}
{"at": "2026-10-02T20:34:26+00:00", "kind": "result", "labels_path": "trials/labels/jm_k2_lam200.csv", "labels_sha256": "7f7da93f39042bca6f1276290cec131e63b5c3209c08bf081e294d5118534bed", "metrics": {"durations": {"0": 558.5, "1": 1632.0}, "eta_short": 0.0007075836325178624, "excess_long": -0.0028023703062194706, "excess_short": -0.0014077924966195028, "excess_short_shift": -0.0007043054950042018, "jumps": 6, "passes_duration": true, "s1_mean": 0.8061251346823298, "s1_min": -0.0403631353065929, "s2": 0.0441184727391592, "score": -0.0005984832854133352, "stability": 0.4251218037107445, "wcss": 102331.82696913595}, "reason": "", "status": "kept", "trial_id": "jm_k2_lam200"}
{"at": "2026-10-02T20:36:06+00:00", "kind": "result", "labels_path": "trials/labels/jm_k2_lam500.csv", "labels_sha256": "3d30a60e5658a1d13ccd968730de75b080ebe372f9ce092d6cb38f2ce244bf8f", "metrics": {"durations": {"0": 1044.0, "1": 996.0}, "eta_short": 0.003205356310666279, "excess_long": 0.007191279748170388, "excess_short": 0.001082209944690736, "excess_short_shift": 0.001749462761484863, "jumps": 6, "passes_duration": true, "s1_mean": 0.7906661586483787, "s1_min": -0.05654924691355417, "s2": 0.0057032795066678885, "score": 0.0004309194628095828, "stability": 0.39818471907752334, "wcss": 102331.82696913595}, "reason": "", "status": "kept", "trial_id": "jm_k2_lam500"}
{"at": "2026-10-02T20:36:11+00:00", "kind": "result", "labels_path": "trials/labels/kmeans_k2.csv", "labels_sha256": "97eff996ab31619f23892e82b1e3853fb47385e2b34798c92190e56deb4834e1", "metrics": {"durations": {"0": 3.0, "1": 3.0}, "eta_short": 0.0019739134644312204, "excess_long": 0.0018655306168055665, "excess_short": -0.0003632053359321689, "excess_short_shift": -2.7567875414539512e-06, "jumps": 316, "passes_duration": false, "s1_mean": 0.925947764864037, "s1_min": 0.33934194258712413, "s2": 0.1703828309456789, "score": -0.00019909656117189138, "stability": 0.5481652979048579, "wcss": 100516.88756453863}, "reason": "baseline", "status": "kept", "trial_id": "kmeans_k2"}
{"at": "2026-10-02T20:47:21+00:00", "kind": "result", "labels_path": "trials/labels/jm_k3_lam5.csv", "labels_sha256": "af9f320877aab3361b79632814ccd887d857fc195270e22b5b24b2d79718cd92", "metrics": {"durations": {"0": 42.5, "1": 55.0, "2": 98.0}, "eta_short": 0.0035973380300123705, "excess_long": -0.006727463175916157, "excess_short": -0.0016705803843506369, "excess_short_shift": -0.0003105817158240076, "jumps": 70, "passes_duration": true, "s1_mean": 0.8123738530632416, "s1_min": 0.33372579464063357, "s2": 0.046326762270122585, "score": -0.00071726420200287, "stability": 0.4293503076666821, "wcss": 90009.29241043884}, "reason": "", "status": "kept", "trial_id": "jm_k3_lam5"}
{"at": "2026-10-02T20:52:07+00:00", "kind": "result", "labels_path": "trials/labels/jm_k3_lam12.csv", "labels_sha256": "6595e4f4a158f6573d8e15b8a47425b0f866d7b835274221d05b33a720e50b3f", "metrics": {"durations": {"0": 64.0, "1": 67.0, "2": 62.0}, "eta_short": 0.002890603048908554, "excess_long": -0.0028906858849924826, "excess_short": -0.0018182301408830666, "excess_short_shift": -0.001008320880013438, "jumps": 38, "passes_duration": true, "s1_mean": 0.8509210751055433, "s1_min": 0.2099948542211152, "s2": 0.045605296850732044, "score": -0.0008150456357937215, "stability": 0.44826318597813763, "wcss": 90394.98900415152}, "reason": "", "status": "kept", "trial_id": "jm_k3_lam12"}
