{"at": "2026-10-02T20:56:05+00:00", "kind": "result", "labels_path": "trials/labels/jm_k3_lam30.csv", "labels_sha256": "9b53023f96b7ec2f03eb297d32d3631eb4687ba903208f60962f27a5c5c836a2", "metrics": {"durations": {"0": 163.0, "1": 249.0, "2": 54.5}, "eta_short": 0.0028340602285513872, "excess_long": 0.010170891871900813, "excess_short": -0.0008695602652645002, "excess_short_shift": -0.000881733979227107, "jumps": 30, "passes_duration": true, "s1_mean": 0.8519824750226244, "s1_min": 0.20961978190412625, "s2": 0.043638204050254606, "score": -0.0003893980776354922, "stability": 0.4478103395364395, "wcss": 90723.5000511606}, "reason": "", "status": "kept", "trial_id": "jm_k3_lam30"}
{"at": "2026-10-02T20:59:08+00:00", "kind": "result", "labels_path": "trials/labels/jm_k3_lam80.csv", "labels_sha256": "0cb7d39cb8d7679b543215220ecb8402145e783c7275a2f8a1cfb19cae3cf0fb", "metrics": {"durations": {"0": 290.0, "1": 398.0, "2": 68.5}, "eta_short": 0.0031963964556117144, "excess_long": 0.0020140053963064296, "excess_short": 0.00016270103474077613, "excess_short_shift": -0.0009194531785633969, "jumps": 19, "passes_duration": true, "s1_mean": 0.8587637085977037, "s1_min": 0.3892618302283627, "s2": 0.06767422207080348, "score": 7.536620497143476e-05, "stability": 0.46321896533425355, "wcss": 91513.31469064493}, "reason": "", "status": "kept", "trial_id": "jm_k3_lam80"}
{"at": "2026-10-02T21:01:39+00:00", "kind": "result", "labels_path": "trials/labels/jm_k3_lam200.csv", "labels_sha256": "453154cf2302ca65b9f4b0c720872009fcd502b5dd0e532ec7e0bbd6469011c3", "metrics": {"durations": {"0": 311.0, "1": 750.0, "2": 48.0}, "eta_short": 0.0051618089050631255, "excess_long": -0.001948984437641463, "excess_short": 0.00010514452683630087, "excess_short_shift": 0.001210341842673767, "jumps": 9, "passes_duration": true, "s1_mean": 0.816288454735329, "s1_min": 0.1908557697522399, "s2": 0.05369639967208032, "score": 4.5737072935707576e-05, "stability": 0.4349924272037046, "wcss": 93638.97468373166}, "reason": "", "status": "kept", "trial_id": "jm_k3_lam200"}
{"at": "2026-10-02T21:03:40+00:00", "kind": "result", "labels_path": "trials/labels/jm_k3_lam500.csv", "labels_sha256": "7966d6e9f1dcf04ab55a6eb17662d9bc75cb650fbec10e5cce6ec33d430fdeb9", "metrics": {"durations": {"0": 727.0, "1": 249.0, "2": NaN}, "eta_short": 0.005154977308779686, "excess_long": 0.018556902617429774, "excess_short": 0.0027702711774930775, "excess_short_shift": 0.0035260406211557174, "jumps": 7, "passes_duration": false, "s1_mean": 0.7454328489505696, "s1_min": -0.05250655261139318, "s2": 0.025749341013356342, "score": 0.0010681918967265277, "stability": 0.385591094981963, "wcss": 94560.77401131233}, "reason": "fails the minimum median duration", "status": "discarded", "trial_id": "jm_k3_lam500"}
{"at": "2026-10-02T21:03:46+00:00", "kind": "result", "labels_path": "trials/labels/kmeans_k3.csv", "labels_sha256": "f24dddb41650e1d10d08935d104a52098821ad359195786bc24ddef894d450aa", "metrics": {"durations": {"0": 3.0, "1": 3.0, "2": 5.0}, "eta_short": 0.004790203685033772, "excess_long": -0.0024229678404866905, "excess_short": 0.0008671826324696489, "excess_short_shift": 0.0011927771775430552, "jumps": 334, "passes_duration": false, "s1_mean": 0.8644382746724174, "s1_min": 0.2217128450810568, "s2": 0.05977200678479871, "score": 0.00040072955241479187, "stability": 0.46210514072860803, "wcss": 89671.77911882733}, "reason": "baseline", "status": "kept", "trial_id": "kmeans_k3"}
{"at": "2026-10-02T21:10:52+00:00", "kind": "result", "labels_path": "trials/labels/jm_k4_lam5.csv", "labels_sha256": "d8c0dfaf43e2b2e0a55e032f0607771b7ccf4809a2f94a9d8983bda6a7ecc243", "metrics": {"durations": {"0": 40.0, "1": 47.0, "2": 45.0, "3": 22.0}, "eta_short": 0.004709221885624953, "excess_long": 0.005886919132444839, "excess_short": -9.292397689395632e-05, "excess_short_shift": -0.0005302641161891459, "jumps": 93, "passes_duration": true, "s1_mean": 0.8964583658133581, "s1_min": 0.3644506648327675, "s2": 0.10887040047421795, "score": -4.670957352466816e-05, "stability": 0.502664383143788, "wcss": 80945.22069378017}, "reason": "", "status": "kept", "trial_id": "jm_k4_lam5"}
{"at": "2026-10-02T21:17:02+00:00", "kind": "result", "labels_path": "trials/labels/jm_k4_lam12.csv", "labels_sha256": "c9bc6f01189e631bc405cdd74c55ed0be137c2b497c0bce8633f8c84cf7b98a9", "metrics": {"durations": {"0": 40.5, "1": 23.5, "2": 66.5, "3": 87.0}, "eta_short": 0.0060323336845521415, "excess_long": 0.0010546717480423573, "excess_short": 0.0010561945973548842, "excess_short_shift": 0.0008103221388947469, "jumps": 67, "passes_duration": true, "s1_mean": 0.8313051978482688, "s1_min": 0.3545797160585635, "s2": 0.1031928596675072, "score": 0.0004935058997933983, "stability": 0.46724902875788804, "wcss": 81411.44339870817}, "reason": "", "status": "kept", "trial_id": "jm_k4_lam12"}
{"at": "2026-10-02T21:21:51+00:00", "kind": "result", "labels_path": "trials/labels/jm_k4_lam30.csv", "labels_sha256": "a87cf9587f2fb4e34ca4276b3bc46d57cb16d89ea4d3f4bbe667f56cfe209572", "metrics": {"durations": {"0": 184.0, "1": 42.5, "2": 31.0, "3": 126.0}, "eta_short": 0.005018640525263919, "excess_long": 0.003654920169576324, "excess_short": -0.00013198926188128738, "excess_short_shift": -0.0008879168737053371, "jumps": 37, "passes_duration": true, "s1_mean": 0.8191123772529589, "s1_min": 0.30489656388940406, "s2": 0.12271704363314254, "score": -6.215568504041844e-05, "stability": 0.4709147104430507, "wcss": 82842.4791945298}, "reason": "", "status": "kept", "trial_id": "jm_k4_lam30"}
{"at": "2026-10-02T21:25:19+00:00", "kind": "result", "labels_path": "trials/labels/jm_k4_lam80.csv", "labels_sha256": "0ff9998ff4cbff608ff9acb1c5fed348148ff74f1b8ff702fb5e8c3aacac8326", "metrics": {"durations": {"0": 465.0, "1": 54.0, "2": 62.5, "3": 763.5}, "eta_short": 0.0015830009516382322, "excess_long": -0.00881782063930586, "excess_short": -0.003782679753213612, "excess_short_shift": -0.004647574752417822, "jumps": 27, "passes_duration": true, "s1_mean": 0.8172250414689937, "s1_min": 0.2419814642438236, "s2": 0.1272862689592554, "score": -0.0017863919053190973, "stability": 0.47225565521412455, "wcss": 83854.04089353113}, "reason": "", "status": "kept", "trial_id": "jm_k4_lam80"}
{"at": "2026-10-02T21:27:49+00:00", "kind": "result", "labels_path": "trials/labels/jm_k4_lam200.csv", "labels_sha256": "778967728437a0b75355b587ad6607198956c0c8c007a09dd1ddffce151b1cf1", "metrics": {"durations": {"0": 312.0, "1": 750.5, "2": 170.0, "3": 46.0}, "eta_short": 0.008596729654934186, "excess_long": 0.002734895776961347, "excess_short": 0.0009025291209937064, "excess_short_shift": 0.0029439858774487843, "jumps": 12, "passes_duration": true, "s1_mean": 0.7315280291766866, "s1_min": 0.28326237153978734, "s2": 0.12783859014036866, "score": 0.0003878016997717775, "stability": 0.42968330965852763, "wcss": 88054.298111601}, "reason": "", "status": "kept", "trial_id": "jm_k4_lam200"}
{"at": "2026-10-02T21:29:49+00:00", "kind": "result", "labels_path": "trials/labels/jm_k4_lam500.csv", "labels_sha256": "45704e00c359df96a20e4f8ee0240dc980efe5ed7a3b6e70bf4b894e2ec9f197", "metrics": {"durations": {"0": 119.0, "1": 375.0, "2": 124.0, "3": 853.0}, "eta_short": 0.013583366810965544, "excess_long": 0.008486282565453106, "excess_short": 0.006346349294379076, "excess_short_shift": 0.0073331085457426235, "jumps": 10, "passes_duration": true, "s1_mean": 0.6424913097704102, "s1_min": 0.09772033930315704, "s2": 0.10319228666523077, "score": 0.002366184283034691, "stability": 0.3728417982178205, "wcss": 90263.14590262035}, "reason": "", "status": "kept", "trial_id": "jm_k4_lam500"}
{"at": "2026-10-02T21:29:56+00:00", "kind": "result", "labels_path": "trials/labels/kmeans_k4.csv", "labels_sha256": "55da67c2a176e2f1fd31c27f05566999c17d2febf7a50368bd49ac72bb1a6e4d", "metrics": {"durations": {"0": 4.0, "1": 4.0, "2": 4.0, "3": 2.0}, "eta_short": 0.002788198535133694, "excess_long": 0.0019323046380580605, "excess_short": -0.0014060063808027145, "excess_short_shift": -0.0019550653872877997, "jumps": 464, "passes_duration": false, "s1_mean": 0.9272202965613624, "s1_min": 0.4842762164824614, "s2": 0.1142133503693175, "score": -0.0007321311763835886, "stability": 0.52071682346534, "wcss": 80628.76488788537}, "reason": "baseline", "status": "kept", "trial_id": "kmeans_k4"}
{"at": "2026-10-02T21:36:37+00:00", "kind": "result", "labels_path": "trials/labels/jm_k5_lam5.csv", "labels_sha256": "96a5602063f785e55716076bcada955ddb8a6b5298bfce841e83a1237f41a8a3", "metrics": {"durations": {"0": 32.0, "1": 19.0, "2": 49.0, "3": 28.0, "4": 23.5}, "eta_short": 0.010011493651530378, "excess_long": 0.015024043006515685, "excess_short": 0.0034401305439525397, "excess_short_shift": 0.0028447412331107855, "jumps": 109, "passes_duration": false, "s1_mean": 0.8506622827148159, "s1_min": 0.45320669012251075, "s2": 0.1326034478948584, "score": 0.0016912812363460753, "stability": 0.4916328653048372, "wcss": 75191.41614344655}, "reason": "fails the minimum median duration", "status": "discarded", "trial_id": "jm_k5_lam5"}
{"at": "2026-10-02T21:42:21+00:00", "kind": "result", "labels_path": "trials/labels/jm_k5_lam12.csv", "labels_sha256": "262c601ebf63a38397cd959bfa251b759e994fb1ce34ddd33107718b9003a522", "metrics": {"durations": {"0": 28.5, "1": 58.0, "2": 45.0, "3": 112.0, "4": 31.0}, "eta_short": 0.01894099210527837, "excess_long": 0.005612731193951757, "excess_short": 0.011736326348893713, "excess_short_shift": 0.011617177369328545, "jumps": 89, "passes_duration": true, "s1_mean": 0.851903270869261, "s1_min": 0.49695177347264635, "s2": 0.14365588489198533, "score": 0.005842103575821547, "stability": 0.49777957788062316, "wcss": 75460.01245172627}, "reason": "", "status": "kept", "trial_id": "jm_k5_lam12"}
{"at": "2026-10-02T21:46:50+00:00", "kind": "result", "labels_path": "trials/labels/jm_k5_lam30.csv", "labels_sha256": "3380e049a5f7cb1871cdbd01b001b2b64ec9619fb2026ed04d1fdb3883aa8a78", "metrics": {"durations": {"0": 91.0, "1": 64.0, "2": 43.0, "3": 254.0, "4": 37.0}, "eta_short": 0.004399992675205484, "excess_long": 0.001750321410265352, "excess_short": -0.0021539536335235003, "excess_short_shift": -0.0030593259753916822, "jumps": 53, "passes_duration": true, "s1_mean": 0.7578975523612425, "s1_min": 0.45961405747538486, "s2": 0.18683862130737316, "score": -0.0010174589569973017, "stability": 0.4723680868343078, "wcss": 77233.32959935722}, "reason": "", "status": "kept", "trial_id": "jm_k5_lam30"}
{"at": "2026-10-02T21:50:12+00:00", "kind": "result", "labels_path": "trials/labels/jm_k5_lam80.csv", "labels_sha256": "cefd2b936e6b2879303b1422fe0a63a4361dbe5a6e8241baba2cc9ac914f23ec", "metrics": {"durations": {"0": 33.0, "1": 131.0, "2": 267.0, "3": 453.5, "4": 25.0}, "eta_short": 0.007623786024998247, "excess_long": -0.012585856069977672, "excess_short": -0.007890442773328869, "excess_short_shift": 0.00030310790703053786, "jumps": 31, "passes_duration": true, "s1_mean": 0.8161741679178761, "s1_min": 0.42765108761206466, "s2": 0.17594001535076936, "score": -0.003914110093844579, "stability": 0.49605709163432277, "wcss": 79156.15044409152}, "reason": "", "status": "kept", "trial_id": "jm_k5_lam80"}
{"at": "2026-10-02T21:52:48+00:00", "kind": "result", "labels_path": "trials/labels/jm_k5_lam200.csv", "labels_sha256": "1bb904abb05b3b8a1e05a2e0be72d941561add3ef0ba1973ceed973596f095e8", "metrics": {"durations": {"0": NaN, "1": 125.0, "2": 139.0, "3": 736.0, "4": 41.0}, "eta_short": 0.013144134591748508, "excess_long": 0.0020690118514484976, "excess_short": -0.00013670822875184313, "excess_short_shift": 0.007063035420268446, "jumps": 16, "passes_duration": false, "s1_mean": 0.6502652901058484, "s1_min": 0.2946062107369146, "s2": 0.15545392433202843, "score": -5.507422333856431e-05, "stability": 0.40285960721893843, "wcss": 83935.06089680079}, "reason": "fails the minimum median duration", "status": "discarded", "trial_id": "jm_k5_lam200"}
{"at": "2026-10-02T21:54:54+00:00", "kind": "result", "labels_path": "trials/labels/jm_k5_lam500.csv", "labels_sha256": "7b1eeda5f7a4553af8d693436e829a260cff58e5e0783cce053dc9ddcbbca8bc", "metrics": {"durations": {"0": 187.0, "1": 311.5, "2": 295.5, "3": 124.5, "4": 124.0}, "eta_short": 0.0019474376590512964, "excess_long": -0.004608193148122337, "excess_short": -0.007253926644029409, "excess_short_shift": -0.005484385869842609, "jumps": 11, "passes_duration": true, "s1_mean": 0.6283957651463692, "s1_min": 0.2025231496822999, "s2": 0.11219288561669306, "score": -0.002686087873017984, "stability": 0.3702943253815311, "wcss": 87738.28618089277}, "reason": "", "status": "kept", "trial_id": "jm_k5_lam500"}
{"at": "2026-10-02T21:55:01+00:00", "kind": "result", "labels_path": "trials/labels/kmeans_k5.csv", "labels_sha256": "f13aee26e7fd54e46d52fe02d2881c0cca50634da94de836bc9a73466a224a3e", "metrics": {"durations": {"0": 5.0, "1": 3.0, "2": 3.0, "3": 3.0, "4": 2.0}, "eta_short": 0.0034099056138713283, "excess_long": -0.0018200347270793723, "excess_short": -0.0028693483921236017, "excess_short_shift": -0.0029301560983408395, "jumps": 482, "passes_duration": false, "s1_mean": 0.8949155266232887, "s1_min": 0.4484310283690297, "s2": 0.16562843094428595, "score": -0.0015215350497114607, "stability": 0.5302719787837873, "wcss": 74304.80235084909}, "reason": "baseline", "status": "kept", "trial_id": "kmeans_k5"}
{"at": "2026-10-02T21:55:02+00:00", "kind": "result", "labels_path": "trials/labels/inertia.csv", "labels_sha256": "50bb4b9aa6220b6f3b3002b3174a5e89f0c1a9662c70a74ba2c0cfe40e779b1b", "metrics": {"eta_short": 0.004063869069778079, "excess_short": 0.0023279561399885433, "excess_short_shift": 0.0011413537660345421}, "reason": "baseline", "status": "kept", "trial_id": "inertia"}
{"at": "2026-10-02T21:55:34+00:00", "code_commit": "7d143ef52f04dc544d6eba9ce168f563231a5104.b626a8ad6de4b5a8f9f83d76ae6baeb0c932369e.3442ea8a6c7155325a9d87b9dab685b8d9969538", "criteria": [{"blocking": true, "name": "stability", "passed": false, "requirement": ">= 0.6", "value": 0.49777957788062316}, {"blocking": true, "name": "separation_vs_inertia_low95", "passed": false, "requirement": "> 0", "value": -0.006237033626063824}, {"blocking": true, "name": "independence_p", "passed": false, "requirement": "< 0.01", "value": 0.038159958180867745}, {"blocking": false, "name": "pbo", "passed": false, "requirement": "<= 0.05", "value": 0.22245532245532246}, {"blocking": false, "name": "s2_halves", "passed": false, "requirement": ">= 0.6", "value": 0.14365588489198533}], "details": {"baselines_separation": {"inertia": 0.0023279561399885433, "kmeans_k2": -0.0003632053359321689, "kmeans_k3": 0.0008671826324696489, "kmeans_k4": -0.0014060063808027145, "kmeans_k5": -0.0028693483921236017}, "baselines_separation_shift": {"inertia": 0.0011413537660345421, "kmeans_k2": -2.7567875414539512e-06, "kmeans_k3": 0.0011927771775430552, "kmeans_k4": -0.0019550653872877997, "kmeans_k5": -0.0029301560983408395}, "columns": ["S", "C", "dL21", "dL63", "dS21", "dS63", "dC63", "logvol5_60", "logr5_20_60", "logr5_60_120"], "configurations": [{"passes_duration": true, "score": 8.680552633112925e-05, "separation": 0.00016829070773637664, "separation_shift": 0.0008444144899593838, "stability": 0.5158070074023815, "trial_id": "jm_k2_lam5"}, {"passes_duration": true, "score": 0.00011218312177815393, "separation": 0.00022896684673526756, "separation_shift": 0.0008537774169442252, "stability": 0.48995356042903687, "trial_id": "jm_k2_lam12"}, {"passes_duration": true, "score": -0.00029986848901822745, "separation": -0.0006346021015439115, "separation_shift": -0.00020063095420374275, "stability": 0.472529933778478, "trial_id": "jm_k2_lam30"}, {"passes_duration": true, "score": -0.0009506749371217912, "separation": -0.0022927730534945834, "separation_shift": -0.00202153567113988, "stability": 0.41463978987052286, "trial_id": "jm_k2_lam80"}, {"passes_duration": true, "score": -0.0005984832854133352, "separation": -0.0014077924966195028, "separation_shift": -0.0007043054950042018, "stability": 0.4251218037107445, "trial_id": "jm_k2_lam200"}, {"passes_duration": true, "score": 0.0004309194628095828, "separation": 0.001082209944690736, "separation_shift": 0.001749462761484863, "stability": 0.39818471907752334, "trial_id": "jm_k2_lam500"}, {"passes_duration": true, "score": -0.00071726420200287, "separation": -0.0016705803843506369, "separation_shift": -0.0003105817158240076, "stability": 0.4293503076666821, "trial_id": "jm_k3_lam5"}, {"passes_duration": true, "score": -0.0008150456357937215, "separation": -0.0018182301408830666, "separation_shift": -0.001008320880013438, "stability": 0.44826318597813763, "trial_id": "jm_k3_lam12"}, {"passes_duration": true, "score": -0.0003893980776354922, "separation": -0.0008695602652645002, "separation_shift": -0.000881733979227107, "stability": 0.4478103395364395, "trial_id": "jm_k3_lam30"}, {"passes_duration": true, "score": 7.536620497143476e-05, "separation": 0.00016270103474077613, "separation_shift": -0.0009194531785633969, "stability": 0.46321896533425355, "trial_id": "jm_k3_lam80"}, {"passes_duration": true, "score": 4.5737072935707576e-05, "separation": 0.00010514452683630087, "separation_shift": 0.001210341842673767, "stability": 0.4349924272037046, "trial_id": "jm_k3_lam200"}, {"passes_duration": false, "score": 0.0010681918967265277, "separation": 0.0027702711774930775, "separation_shift": 0.0035260406211557174, "stability": 0.385591094981963, "trial_id": "jm_k3_lam500"}, {"passes_duration": true, "score": -4.670957352466816e-05, "separation": -9.292397689395632e-05, "separation_shift": -0.0005302641161891459, "stability": 0.502664383143788, "trial_id": "jm_k4_lam5"}, {"passes_duration": true, "score": 0.0004935058997933983, "separation": 0.0010561945973548842, "separation_shift": 0.0008103221388947469, "stability": 0.46724902875788804, "trial_id": "jm_k4_lam12"}, {"passes_duration": true, "score": -6.215568504041844e-05, "separation": -0.00013198926188128738, "separation_shift": -0.0008879168737053371, "stability": 0.4709147104430507, "trial_id": "jm_k4_lam30"}, {"passes_duration": true, "score": -0.0017863919053190973, "separation": -0.003782679753213612, "separation_shift": -0.004647574752417822, "stability": 0.47225565521412455, "trial_id": "jm_k4_lam80"}, {"passes_duration": true, "score": 0.0003878016997717775, "separation": 0.0009025291209937064, "separation_shift": 0.0029439858774487843, "stability": 0.42968330965852763, "trial_id": "jm_k4_lam200"}, {"passes_duration": true, "score": 0.002366184283034691, "separation": 0.006346349294379076, "separation_shift": 0.0073331085457426235, "stability": 0.3728417982178205, "trial_id": "jm_k4_lam500"}, {"passes_duration": false, "score": 0.0016912812363460753, "separation": 0.0034401305439525397, "separation_shift": 0.0028447412331107855, "stability": 0.4916328653048372, "trial_id": "jm_k5_lam5"}, {"passes_duration": true, "score": 0.005842103575821547, "separation": 0.011736326348893713, "separation_shift": 0.011617177369328545, "stability": 0.49777957788062316, "trial_id": "jm_k5_lam12"}, {"passes_duration": true, "score": -0.0010174589569973017, "separation": -0.0021539536335235003, "separation_shift": -0.0030593259753916822, "stability": 0.4723680868343078, "trial_id": "jm_k5_lam30"}, {"passes_duration": true, "score": -0.003914110093844579, "separation": -0.007890442773328869, "separation_shift": 0.00030310790703053786, "stability": 0.49605709163432277, "trial_id": "jm_k5_lam80"}, {"passes_duration": false, "score": -5.507422333856431e-05, "separation": -0.00013670822875184313, "separation_shift": 0.007063035420268446, "stability": 0.40285960721893843, "trial_id": "jm_k5_lam200"}, {"passes_duration": true, "score": -0.002686087873017984, "separation": -0.007253926644029409, "separation_shift": -0.005484385869842609, "stability": 0.3702943253815311, "trial_id": "jm_k5_lam500"}], "final_model": {"days_by_decade": {"0": {"1980": 107, "1990": 356, "2000": 371, "2010": 20, "2020": 44}, "1": {"1990": 109, "2000": 683, "2010": 330}, "2": {"1980": 196, "1990": 127, "2000": 317, "2010": 569}, "3": {"1980": 197, "1990": 1854, "2000": 1130, "2010": 1582, "2020": 1087}, "4": {"1990": 57, "2020": 58}}, "median_duration_days": {"0": 28.5, "1": 58.0, "2": 45.0, "3": 112.0, "4": 31.0}, "s1_mean": 0.851903270869261, "s1_min": 0.49695177347264635, "s2": 0.14365588489198533, "separation_long": 0.005612731193951757}, "ftic_states": 2, "gate": {"eta_difference_high": 0.04371045727258514, "eta_difference_low": -0.006237033626063824, "eta_difference_point": 0.00940837020890517, "independence_statistic": 26.25495335333804, "n_weeks": 1913.0}, "limitations": ["DGS30 between 2002-02-19 and 2006-02-08 is built differently from the rest of the series.", "S1 is high almost by construction: consecutive windows share most of their data.", "PBO ranks configurations by raw eta-squared, so it favours grids that mix different K.", "Velocities are in basis points, so the 1980s can dominate the extreme regimes.", "A forward change of exactly zero counts as 'down' in the independence test.", "separation_shift uses the older chance level (groups slid in time). It is a declared sensitivity check: it is reported and never decides.", "Evidence for jump models comes from equities; these tests are the criterion for rates."], "n_effective": 23, "n_trials": 24, "score_winner": "jm_k5_lam12"}, "final_trial_id": "jm_k5_lam12", "kind": "report", "notes": ["FTIC prefers K=2; the score prefers K=5.", "PBO above the limit: prune the grid and repeat as new trials.", "S2 (halves) is below the threshold: review even though the average passes."], "snapshot_hash": "402c4c41fb184462bc47d8d7e1d04743b713e9a0bab0a6c71925f4227623b1dd", "trial_id": "report", "verdict": "no-go"}
